label,Lexikalizazioa copia,wikidata,label_lang,source_url,def,def_lang
Usuario de drogas por vía intravenosa (UDVI),UDVI,,es,https://drogues.gencat.cat/es/ciutadania/glossari-00001/index.html,Usuario de drogas por vía intravenosa. Término englobado en las siglas UDVP (usuario de drogas por vía parenteral).,es
Usuario de drogas por vía parenteral (UDVP),Usuario de drogas por vía parenteral (UDVP),,es,https://drogues.gencat.cat/es/ciutadania/glossari-00001/index.html,"Usuario de drogas por vía parenteral. Las inyecciones pueden administrarse por vía intramuscular, subcutánea, intravenosa (IV), entre otros.",es
Uso de drogas,drug use,Q110207349,es,https://drogues.gencat.cat/es/ciutadania/glossari-00001/index.html,"Término que en algunas ocasiones se utiliza como sinónimo de consumo no perjudicial de drogas, como en el caso del consumo de medicamentos bajo prescripción facultativa.",es
Uso controlado de drogas,Uso controlado de drogas,,es,https://drogues.gencat.cat/es/ciutadania/glossari-00001/index.html,"Mantenimiento de un uso regular, no compulsivo, de sustancias psicoactivas, que no interfiere con el funcionamiento cotidiano de la vida de una persona.",es
Uso recreativo,recreational drug use,Q7708739,es,https://drogues.gencat.cat/es/ciutadania/glossari-00001/index.html,"Consumo de una droga, normalmente ilegal, en situaciones sociales o relajantes, que implica que no existe dependencia ni otros problemas.",es
Zoppsia,Zoppsia,,es,https://drogues.gencat.cat/es/ciutadania/glossari-00001/index.html,"Visión de animales (serpientes, insectos, etc.) que normalmente forma parte de un proceso de delírium trémens o de otros estados de confusión o alucinación inducidos por un consumo de sustancias.",es
Comedown,Comedown,Q5151412,en,https://positivechoices.org.au/teachers/glossary,"Taking illegal drugs can lead to experiencing negative after-effects sometimes known as a ‘comedown’ or ‘crash’, which are the feelings experienced as the drug wears off.",en
Polydrug use,Polydrug use,,en,https://positivechoices.org.au/teachers/glossary,Mixing drugs or taking one drug when under the influence of another drug is known as polydrug use.,en
Serotonin Syndrome,Serotonin Syndrome,,en,https://positivechoices.org.au/teachers/glossary,"A life-threatening condition that usually starts within 24 hours of taking the drug. It occurs when the brain is overloaded with a neurotransmitter called serotonin. Symptoms include coma, seizures, shaking, confusion, rigid muscles, rapid heartbeat, and overheating.",en
Decriminalisation,decriminalization,Q903453,en,https://www.drugsandalcohol.ie/glossary/,"When drug use and possession are decriminalised, criminal charges are not applied.",en
Detoxification,drug detoxification,Q1345789,en,https://www.drugsandalcohol.ie/glossary/,"A process in which the body rids itself of a drug, or its metabolites. Medically-assisted detoxification may be needed to help manage a person’s withdrawal symptoms. Detoxification alone is not a treatment for substance use disorders, but this is often the first step in a drug treatment program.",en
Drug consumption facilities,Design considerations for supervised consumption facilities (SCFs): preferences for facilities where people can inject and smoke drugs.,Q44989797,en,https://www.drugsandalcohol.ie/glossary/,Drug consumption facilities are places in which drug users can use illicit drugs under the supervision of medically trained staff. They exist in several European countries and are usually located in areas where there is an open drug scene and injecting in public places is common. Their primary goal is to reduce morbidity and mortality by providing a safer environment for drug use and training clients in safer forms of drug use.,en
European Monitoring Centre for Drugs and Drug Addiction (EMCDDA),European Monitoring Centre for Drugs and Drug Addiction,Q1377256,en,https://www.drugsandalcohol.ie/glossary/,The EMCDDA exists to provide the EU and its Member States with a factual overview of European drug problems and a solid evidence base to support the drugs debate.,en
European School Survey Project on Alcohol and other Drugs (ESPAD),Methodological background and descriptive features of the ESPAD 2011 Study (European School Survey Project on Alcohol and other Drugs) in Hungary,Q43691438,en,https://www.drugsandalcohol.ie/glossary/,ESPAD is a collaborative effort of independent research teams in more than forty European countries and the largest cross-national research project on adolescent substance use in the world. The overall aim with the project is to repeatedly collect comparable data on substance use among 15–16 year old students in as many European countries as possible.,en
Gateway drug,Gateway drug,,en,https://www.drugsandalcohol.ie/glossary/,"An illicit or licit drug, use of which is regarded as opening the way to the use of another drug, usually one viewed as more problematic.",en
Hallucination,hallucination,Q130741,en,https://www.drugsandalcohol.ie/glossary/,Apparent perception of an external object or person when no such object or person is present.,en
Legalisation,drug liberalization,Q1638361,en,https://www.drugsandalcohol.ie/glossary/,Drug legalisation removes all penalties for possession and personal use of a drug,en
Maintenance therapy,Maintenance therapy,Q6736822,en,https://www.drugsandalcohol.ie/glossary/,Treatment of drug dependence by prescription of a substitute drug for which cross-dependence and cross-tolerance exist. The term is sometimes in reference to a less hazardous form of the same drug used in the treatment.,en
Non-medical use,Non-medical use,,en,https://www.drugsandalcohol.ie/glossary/,"Use of a prescription drug, whether obtained by prescription or otherwise, other than in the manner or for the time period prescribed, or by a person for whom the drug was not prescribed. The term sometimes also covers the use of illicit drugs.",en
Social reintegration,reintegration,Q9305716,en,https://www.drugsandalcohol.ie/glossary/,Social reintegration is not a term that is used or defined consistently across EU Member States but it is a key aspect of full recovery from drug dependence. Its scope is wider than the traditional treatment focus on pharmacological and psychosocial outcomes.,en
The National Drug Related Deaths Index (NDRDI),"The role of alcohol dependency in deaths among people with epilepsy recorded by the National Drug-Related Deaths Index (NDRDI) in Ireland, 2004-2013.",Q40440894,en,https://www.drugsandalcohol.ie/glossary/,The National Drug Related Deaths Index is a census of drug-related deaths (such as those due to accidental or intentional overdose) and deaths among drug users in Ireland. It will also record alcohol-related deaths.,en
Universal prevention,Universal prevention,,en,https://www.drugsandalcohol.ie/glossary/,"Universal prevention strategies address the entire population (national, local community, school, neighbourhood) with messages and programmes aimed at preventing or delaying the abuse of alcohol, tobacco, and other drugs.",en
