claim_id	entity	context
Q46746-1BBDE95D-3F81-45FB-B469-ED416DC2AD35	Larramendi M. de	El término vizcaíno es kiriki(ñ)o, que figura en el Suplemento de Larramendi, 343: «Erizo, sagarroya, quiriquioa».
Q46746-1BBDE95D-3F81-45FB-B469-ED416DC2AD35	Larramendi M. de	de Ochandiano escribe: «añade kirikiño latza, erizo (animal)», se limita, parece, a añadir una forma, sin rectificar la recogida por Larramendi.
Q46746-2A415469-4EDD-4CAE-B558-A122458F39C8	Larramendi M. de	argitasun franko Larramendik Mendibururekin (eta Kardaberatz Mendibururekin dabil, batik bat) izan zituen harremanez.
Q46746-31FDD3DC-3CD8-40FC-A7B4-D39DCC10F429	Larramendi M. de	el compuesto kardilaun, kardillaun «vilano, flor del cardo» (kardu «cardo») según Larramendi. Observemos que también este autor se dio cuenta del parecido entre el término vasco y el romance aunque lo interpretara según su método habitual: «Vilano, viene de el Bascuence illauna, que significa pelusa, moho».
Q46746-44241C5E-4EA4-4219-89C5-81A777CB0AD0	Larramendi M. de	No hay que escarbar mucho, en efecto, para encontrar algún texto por el estilo de éste, no recogido por Tovar, que procede de la contestación de don Juan Valera en la recepción pública de don Francisco de Paula Canalejas en la Academia Española, que no era «Real» en 1869: «Astarloa, Sorreguieta, Erro, Larramendi y el abate Iharce Bidassouet de Arostegui sostenían que el vascuence fue la lengua que se habló en el Paraíso».
Q46746-701EDDEB-6343-4E0E-A59D-249ACAFE817B	Larramendi M. de	lexicografía vasca es la obra del Padre Larramendi, cuyas indicaciones, a causa del amplio margen que concedió a la inventiva cuando la información le faltaba, no se sabe cómo valorar muchas veces.
Q46746-701EDDEB-6343-4E0E-A59D-249ACAFE817B	Larramendi M. de	En efecto, puede demostrarse en más de una ocasión que voces de Larramendi a las que Azkue no dio entrada en su Diccionario, sin duda por creerlas manufacturadas por el jesuita, son totalmente auténticas, como acreditadas en fuentes anteriores y por lo tanto independientes de él.
Q46746-701EDDEB-6343-4E0E-A59D-249ACAFE817B	Larramendi M. de	Azkue pecó por defecto cuando, al cerrar con ostentación todas las puertas del diccionario al peligroso Larramendi, le dejó varios portillos mal atrancados por los cuales éste pudo colarse, aunque fuera bajo muy distintos disfraces que le hacen difícil de reconocer.
Q46746-701EDDEB-6343-4E0E-A59D-249ACAFE817B	Larramendi M. de	Incluso se diría que la influencia o el contagio de Larramendi alcanzó ya a su contemporáneo Etcheberri, el de Sara.
Q46746-833C1030-D389-4759-BE36-CEFBA01D6B3F	Larramendi M. de	No vale la pena de extenderse sobre los antecedentes de la dialectología vasca, que son de sobra conocidos, a partir de Oihenart y Larramendi, por lo menos.
Q46746-86E02C24-C699-48D2-8F9B-FF9C4716405E	Larramendi M. de	Aurpegi lasaiagoa ager dezakete bai Bascongada-k Muniberekin eta bai Loiolak Larramendirekin.
Q46746-86E02C24-C699-48D2-8F9B-FF9C4716405E	Larramendi M. de	Hizkuntzari dagokionez, bat datoz, gutxi gorabehera Munibe eta Larramendi, hura honekin ados datorrela esatea ez baldin bada zuzenago.
Q46746-9A503F01-5CD2-479E-BA79-58FA1DEB8149	Larramendi M. de	Il y a beaucoup à dire en faveur des travaux linguistiques de Larramendi, d’Astarloa, d’Ithurry, d’Azkue, premier président d’Euskaltzaindia, et de tant d’autres dont les noms sont peut être moins divulgués.
Q46746-A3CE3533-74A4-44B8-B896-EA4B36FF3AD1	Larramendi M. de	Como compendio del punto de vista de los primeros vale el título de una obra que el mayor de ellos, el padre Larramendi, publicó en Salamanca en 1728: De la antigüedad y universalidad del Bascuence en España, de sus perfecciones y ventajas sobre otras muchas lenguas.
Q46746-A3CE3533-74A4-44B8-B896-EA4B36FF3AD1	Larramendi M. de	El lector echará de ver, sin embargo, que las proposiciones de Larramendi, inspiradas al parecer por un ciego entusiasmo, están sujetas al freno de la más estricta prudencia política.
Q46746-BD8BC7C6-C3FC-4B18-AC38-CE7D2D2546C0	Larramendi M. de	Larramendiren ezinak, hitz batean, egina dirudi atzera ere.
Q46746-CE670307-1F98-4760-BCD5-1D3463DF6C8A	Larramendi M. de	zuen han, ikasten eta irakasten, Dotoradutzakoak prestatzen zituen bitartean bere gain izan baitzuen, Tovarren ordez, honek sortua zuen «Manuel de Larramendi» euskal ikaskuntza katadera, Pontifizian ere berebat linguistika irakasten zuelarik.
Q46746-CE670307-1F98-4760-BCD5-1D3463DF6C8A	Larramendi M. de	Ez diot deus kenduko bere hitz-etorri eta hitz jarioaren orrazketari, antzinakoen segizioko baita arlo horretan, inor baldin bada: hots, Axular, Larramendi eta gure arteko beste hainbesteren segizioko;
Q47776-4D960F3E-F472-453E-8F4C-0EDCDCCA4530	Tovar A.	Tovar dijo en cierta ocasión, hablando de Azkue, que éste, como eslabón de la tradición con plenos derechos, considerándose fuente tanto como recolector de ésta, se creía por ello facultado para retocar lo que oía o leía, obedeciendo a más altos imperativos que la fidelidad al texto.
Q47776-536459CF-A856-4235-9EA6-119C803C6B5F	Tovar A.	Encuentro una opinión expresada categóricamente en A. Tovar,3 aunque ignoro si representa su pensamiento actual, que merece ser copiada extensamente porque plantea de una manera perfecta el primer problema, que es al mismo tiempo el más importante, pues el segundo no existe más que si aquél puede resolverse en un sentido determinado: «.
Q47776-6D6C5FDA-6422-4A65-A553-254A82D22CFC	Tovar A.	Tovar no lleve a buen término su proyecto ya muy adelantado de un diccionario etimológico vasco, no ha advertido el Sr.
Q47776-80E54270-41D2-40F9-90D9-022CFE2B169D	Tovar A.	24 Ahora menos que nunca deben ser olvidados los amigos de los tiempos difíciles, entre los cuales se cuenta en muy primer lugar Antonio Tovar, desinteresado protector de los estudios vascos y fundador de la Cátedra «Manuel de Larramendi» en esta Universidad de Salamanca.
Q46747-95E48055-2A77-4CAF-A240-2690B900983F	Larrañaga G.	Berri horiek, gainerako irakurleak ere gaiaz jabe daitezen, G. Larrañagak Aránzazu aldizkari ederrean (122. zenbakia, aurtengo abuztukoa) argitara duen idazlan batean ikusi dituzu: «El euskera y el dravídico (Sugerencias de un artículo)» deritzanean.
Q46750-B0BDB39B-5E5E-45D6-9FDB-7CE09A540D1D	Larrasquet J.	Larrasquet da sólo ülhántx «milano» y corrige expresamente a Lhande: «l’a final est l’article et n’appartient pas au radical».
Q46758-08F94075-566A-4CF1-86FC-B2B7BAA5E9C1	Larzabal P.	Euskal idazleen barrutian inork baldin badaki nora doan eta norekin ari den, Piarres Larzabal apaiz teatrogilea duzue inor hori.
Q46758-08F94075-566A-4CF1-86FC-B2B7BAA5E9C1	Larzabal P.	Honako liburu honen iruzkina: Piarres Larzabal, Bordaxuri, Tolosa, Auspoa, 1962.
Q46336-F8615BF2-50AE-4EC4-AD89-0FBDFEF90234	Goti Iturriaga J. L.	En relación con un punto que toqué de paso, la historia de la medicina entre nosotros es atendida con especial dedicación por Luis S. Granjel y, en nuestra Universidad, por el Seminario de Historia de la Medicina que dirige José Luis Goti Iturriaga.
Q46337-23A4285E-0355-4122-929D-613460AC0B9A	Charencey	Procedían más probablemente del conde de Charencey, fundador en 1863, con nuestro Antoine d’Abbadie, de la Société de Linguistique de París.
Q46337-23A4285E-0355-4122-929D-613460AC0B9A	Charencey	de Paris et de la naissance d’Antoine Meillet]»d, BSL 66 (1971), 19-34, sobre todo p. 23: «le comte de Charencey, dont l’activité et le dévou ement ne doivent pas être oubliés, se plaisait à des étymologies de mots rares ou à des rapprochements entre des langues lointaines qui malheureusement étaient toutes aussi mal connues».
Q46344-43415E39-D9E6-4ABB-87BD-7C5101BED237	Grammont M.	En los ejemplos comprendidos en los dos últimos apartados resultan lo que Grammont llamaba groupes disjoints: la aspiración va al comienzo de la sílaba siguiente a la que termina en sonante, como puede verse ya en NAR·HVN·GE·SI A·BI·SVN·HA·RI en la inscripción romana de Lerga, donde la interrupción marca la silabación.
Q46344-597236B1-C93A-416E-A73C-89160B053300	Grammont M.	Esta pérdida, que acaso no se compadece bien con las leyes de Grammont, se da en lengua vasca con una frecuencia que no tiene comparación posible en las lenguas de cuya evolución sé alguna cosa.
Q46352-228E0D6A-1757-459C-9EAE-C0843DC58C84	Grases P.	Honako liburu honen iruzkina: Vicente de Amézaga Aresti, Hombres de la Compañía Guipuzcoana, prólogo por Pedro Grases, Caracas, Banco Central de Venezuela, 1963.
Q46355-DC9CD58A-DBA2-4842-8F4E-532FD86FF7E1	Greenberg J. H.	Atendiendo a la estructura morfológica, se podría calificar de «aglutinante» a la lengua vasca, en la medida en que esa denominación tiene algún sentido y lo tiene si, con Greenberg, lo consideramos como un parámetro que en textos de una u otra lengua puede alcanzar un valor más alto o más bajo.
Q46367-0245EE8D-7510-470D-B57D-AAC4BC04E14F	Grunig B.	sobre «Gramáticas generativas y transformación» de Blanche Grunig, cuya competencia es bien conocida.
Q46370-17CD331C-437C-4088-8162-3957B1B44FBE	Guerra J. C.	‘culebro’ del texto de Barcelos, que Guerra sí recogió (v. c«Ilustraciones genealógicas de los linajes bascongados contenidos en las Grandezas de Es
Q46370-17CD331C-437C-4088-8162-3957B1B44FBE	Guerra J. C.	También toma, de Jon Juaristi, un pasaje de la Crónica de siete casas de Vizcaya y Castilla, publicada por J. C. de Guerra, que ya fue incluido en la relación de Jon Bilbao, «La cultura tradicional en la obra de Lope García
Q46389-6100CE83-AB4C-4213-BB42-BC34EA920B93	Gyármathi S.	Parece olvidarse que la obra capital de S. Gyármathi (1799) es anterior a las de Bopp y Rask (bautizado, por cierto, Sigmund en la página 215).
Q46402-3DD21A60-13A2-452F-9CED-0D48628CA0EC	Hammett D.	Bestetan Loidiz esana berresatea zilegi bazait, ez du honek ere Dashiell Hammettekin ezaupide luzerik.
Q46403-E7612BBC-70BC-4395-8AD0-D3B75E8C31DA	Hamp E. P.	No se trata de un manual en el que se intenta exponer sistemáticamente la materia, ni tampoco de un diccionario, por el estilo de los bien conocidos, de contenido que rebasa más o menos los marcos de lo propiamente lingüístico, de Hamp, de Marouzeau o, entre nosotros, de Lázaro Carreter.
Q46418-3B163ACF-8312-4327-A36F-01E894BFA1CC	Harriet Martin	M. Harrietek ederki ezagutu zuen hori: ik.
Q46418-3B163ACF-8312-4327-A36F-01E894BFA1CC	Harriet Martin	8. Hauxe da Harrieten zerrenda, guri dagokigun aldetik osoa.
Q46419-1A73640D-E8CB-4109-9305-9BBBC4DDF26D	Harriet Maurice	Prescindiendo de lastro «paja», que al parecer no cuenta a su favor con otra autoridad que la de Harriet, no me parece que ostro «hoja» junto a osto (p. 37, núm.
Q46419-62A9CF44-E664-41AC-A7CE-23BCBE898051	Harriet Maurice	Estos disfraces o pseudónimos se llaman, por ejemplo, Añibarro, Iztueta, Hervás y Panduro, Humboldt, Harriet, el mismo Haraneder retocado por Harriet, etc.
Q46409-C3F7B17C-308D-467B-9D75-88BAD9197933	Haraneder J.	Estos disfraces o pseudónimos se llaman, por ejemplo, Añibarro, Iztueta, Hervás y Panduro, Humboldt, Harriet, el mismo Haraneder retocado por Harriet, etc.
Q46410-BEA031BF-D1F4-40CD-8055-EA51A31DB865	Harff A. von	Entre ellas se cuentan el primer vocabulario, recogido en el siglo XII por Aimery Picaud de Parthenay-le-Vieux, autor de una guía del peregrino a Santiago, o el que compuso, con palabras y frases, el también peregrino Arnold von Harff de Colonia a finales del siglo XV. Poco más tarde, ya en letras de molde, viene el del humanista italiano Lucio Marineo Siculo.
Q46413-5E688F42-F50B-4A49-AEFE-295E9902815A	Haritschelhar J.	1 J. Haritschelhar, dir.
Q46413-878FE4D6-71A6-42FC-8F3E-9AA90D1591C5	Haritschelhar J.	Ez zait berehalakoan ahaztuko oraindik orain, Paueko pirineisten batzarrean, hartu nuen bihotzondokoa Haritschelharrek gure bertsolariaren bizitza eta heriotza tristeaz —galeretan hil baitzen— argitasun berriak ematen zizkigularik.
Q46414-DFA6B945-A6FE-498B-B02E-02D2AA44E7BC	Harizmendi C. de	Idazle hori C. Harizmendi dugu, bere Ama Virginaren hirur officioac deritzan liburuan (1660).
Q46435-C62DFCCE-C464-4668-BD8F-2BB26B2439BF	Hegel G. W. F.	Pero, aunque se creía adivinar algún nexo entre las lenguas germánicas y las clásicas (a las que vino a juntarse, de manera decisiva, el indio antiguo), esta convicción no terminó de tomar forma hasta principios del siglo XIX. De la impresión que esto produjo, sobre gentes de lengua germánica sobre todo, da fe, por ejemplo, este texto de Hegel: «El descubrimiento, hace veintitantos años, del sánscrito y de sus relaciones con las lenguas europeas, ha sido un gran hallazgo histórico semejante al de un mundo nuevo.
Q46439-7B6E20E7-40DB-4796-BF48-B2D78052E1C2	Heguy I.	Horrela izendatu zuen Heguy adiskideak, oroituko zarete, Etxeberri bertso-lanera bultzatu zuen garra (ardor).
Q46439-7B6E20E7-40DB-4796-BF48-B2D78052E1C2	Heguy I.	Heguyren azken neurtitzean hor dakuskezue eskuz erantsia dagoen oh hori, makulu hori gabe neurtitza motz gelditzen zelakoan (diceris, itxuraz, orainaldikoa baita):
Q46442-DA251546-AE6F-44BA-B306-9666AE5CDEDC	Heimsoeth H.	No está que digamos libre de este pecado quien llegó a convencer en España a toda una generación de que Dilthey, Heimsoeth, Scheller, Simmel y compañía (sin olvidar a Aloys Müller) eran la última palabra del pensamiento universal, que ni por casualidad había llegado a expresarse en inglés.
Q46445-0C400CD4-8BD9-4938-A061-C9B19EA52C5B	Hemingway E.	Hemingwayren azkenekoetakoa izanik, aurrena sartu da gure hizkuntzan.
Q46445-0C400CD4-8BD9-4938-A061-C9B19EA52C5B	Hemingway E.	Hemingwayren kontatzeko modu soila, elkorra itxuraz eta inguruz inguru nora gabe dabilena, ez da bihurtzen erraza, ezta alderatzeko ere, batez ere bestelako bideetara ohitua eta jarria dagoen gurea bezalako hizkuntza batean.
Q46445-0C400CD4-8BD9-4938-A061-C9B19EA52C5B	Hemingway E.	Honako liburu honen iruzkina: E. Hemingway, Agurea eta itxasoa, eusk.
Q46446-B640E129-70BA-4C4C-9A72-8AA5C34B93B6	Henao G. de	Ahí están, en todo caso, el vallisoletano padre Henao y el conquense Hervás y Panduro, cuya dependencia de autores vascos (y muy en especial de su conmilitón Larramendi) está muy bien indicada por Tovar, que no son menos vasquistas, en el sentido que aquí se considera, que nuestros paisanos más recalcitrantes.
Q46448-6265F8D9-5BF7-4414-8F68-A760A6A9E957	Henry V.	17 Según Meillet, Introduction à l’étude comparative des langues indo-européennes, París 19378, el Précis de grammaire comparée du grec et du latin de V. Henry
Q46455-69F8FE27-EC38-4C64-BB49-CEA270F2D2BA	Hérelle G.	San Sebastiánd, Lur, 1972. Si no me equivoco, la opinión de Urquijo en esa materia, nada personal, no era más que el fiel reflejo de lo que podía pensar el vizcaíno o guipuzcoano medio, en la medida en que podía entender el texto: me refiero, claro es, a la versión francesa de G. Hérelle (1908), el traductor de Blasco Ibáñez, edición en la que Urquijo tuvo algo que ver.
Q46470-2D986163-0E1E-4E0D-BAFB-5056C93FB10C	Hervás y Panduro L.	Estos disfraces o pseudónimos se llaman, por ejemplo, Añibarro, Iztueta, Hervás y Panduro, Humboldt, Harriet, el mismo Haraneder retocado por Harriet, etc.
Q46470-5D3E25BA-C449-476B-B5F8-961E55539CB3	Hervás y Panduro L.	Ahí están, en todo caso, el vallisoletano padre Henao y el conquense Hervás y Panduro, cuya dependencia de autores vascos (y muy en especial de su conmilitón Larramendi) está muy bien indicada por Tovar, que no son menos vasquistas, en el sentido que aquí se considera, que nuestros paisanos más recalcitrantes.
Q46470-827BBE96-2C05-46F0-8860-34AEA6FD835E	Hervás y Panduro L.	Todavía para Hervás, hacia 1800, era una «lengua matriz» que correspondería a una de las estirpes, cuyo número llegó a fijarse en 72, del catálogo de Génesis, 11.
Q46478-7C40B277-5A72-4F99-814E-C383FCAE01A2	Hiribarren J. M.	apho-onddo «mauvais potiron» (Lhande, tomado de Hiribarren), vizc.
Q45967-4951F440-E685-42B9-984D-85711838C28E	Echave B. de	Garibay, transmisor de cantares y refranes, merece, aun en estos menesteres, ser separado de gente sin talento, saber ni originalidad como el bueno de Baltasar de Echave, con la cual le solemos traer mezclado indiscriminadamente.
Q45974-36BA3762-57DB-4FE6-8075-4C8BFC559661	Echegaray B.	Sería pedir demasiado que éste hubiera empezado por discutir el concepto mismo de ciencia del autor de La ciencia española: sobre esto, José Echegaray, tan mal dramaturgo como se quiera, había expresado tiempo atrás ideas mucho más aceptables que las de don Marcelino.
Q45974-36BA3762-57DB-4FE6-8075-4C8BFC559661	Echegaray B.	Merece recogerse el programa de Carmelo de Echegaray, p. 66, que su hermano Bonifacio realizó en buena medida, aunque no en el campo específico del derecho político: «.
Q45975-4A3B49F7-5E75-4B6A-8C9E-B1E97858FB89	Echegaray C.	Sería pedir demasiado que éste hubiera empezado por discutir el concepto mismo de ciencia del autor de La ciencia española: sobre esto, José Echegaray, tan mal dramaturgo como se quiera, había expresado tiempo atrás ideas mucho más aceptables que las de don Marcelino.
Q45975-4A3B49F7-5E75-4B6A-8C9E-B1E97858FB89	Echegaray C.	Merece recogerse el programa de Carmelo de Echegaray, p. 66, que su hermano Bonifacio realizó en buena medida, aunque no en el campo específico del derecho político: «.
Q45976-E4688C59-73EA-47F3-B47B-0E805F5AB415	Echegaray J.	Sería pedir demasiado que éste hubiera empezado por discutir el concepto mismo de ciencia del autor de La ciencia española: sobre esto, José Echegaray, tan mal dramaturgo como se quiera, había expresado tiempo atrás ideas mucho más aceptables que las de don Marcelino.
Q45976-E4688C59-73EA-47F3-B47B-0E805F5AB415	Echegaray J.	Merece recogerse el programa de Carmelo de Echegaray, p. 66, que su hermano Bonifacio realizó en buena medida, aunque no en el campo específico del derecho político: «.
Q45985-12EFEE37-D1CD-4E94-BF41-ABB78C4B7DBC	Egan	Orrialde hauetan ikus daitezke, oso-osorik, nik Egan aldizkarian 1954-1961 bitartean zinemaz agertu nituenak oro.
Q45985-12EFEE37-D1CD-4E94-BF41-ABB78C4B7DBC	Egan	Egan izan da, nik dakidanez, gure artean eta euskaraz lehenbiziko aldiz zinema-gaiak jarraikiro astindu dituen aldizkaria: aitzindaririk izan baldin badu, berriz ere diot, ez dut nik ezagutzen eta besteren argien begira gelditzen natzaizue.
Q45985-12EFEE37-D1CD-4E94-BF41-ABB78C4B7DBC	Egan	Egan-eko zuzendarietakoak, eta Gurutz Ansolak argitara zituztenak ere.
Q45988-DF58A684-0535-49F3-B347-3A70EC1DBC5D	Eguiateguy J.	Gipuzkoako Diputazioko Liburutegiak erosi berria du eskuizkribu bat, Eguiateguy delako horrena.
Q45988-DF58A684-0535-49F3-B347-3A70EC1DBC5D	Eguiateguy J.	/ Juseff Eguiateguy Suberoan / errégent denaren obra / amoris mei Patria signum sit tibi Liberarii [?] / Munus.
Q45988-DF58A684-0535-49F3-B347-3A70EC1DBC5D	Eguiateguy J.	Honako artikulu honen eranskina: D. Peillen, «Juseff Eguiateguy, Larramendiren zuberotar jarraikizale bat», Egan 1963, 75-77.
Q45990-A392613F-8F31-4C1D-9A4F-6B40B45E5B13	Eguren E.	la de Aranzadi, que tuvo pronto a su lado a Eguren, sigue todavía representada por Barandiarán, por no citar más que al primero y mayor, con ambiciones cada vez más amplias;
Q45996-D7A89D3D-E1CE-4E4D-BBE9-19E3A382B8EC	Eizmendi I. (‘Basarri’)	Pero del mismo modo que a la señora Oliver (o a Agatha Christie, madre de la criatura) no le costaba trabajo dar quince explicaciones distintas tan verosímiles unas como otras de un crimen misterioso que nadie acertaba a comprender, estoy seguro de que Ignacio Eizmendi, cuya desconfianza por cuanto se ha consignado por escrito antes de 1930 (y después de 1950) es notoria, se lo figurará sin mayor esfuerzo.
Q46002-2ED16EF8-3594-49E4-B785-6A58117AF0CD	Eleizalde L.	Lo mismo da que el contradictor fuera Luis de Eleizalde, Pío Baroja o Juan de Olazábal: don Julio, que no daba un paso atrás cuando creía hallarse en posesión legítima de su terreno, se mantuvo siempre dentro de la más estricta corrección.
Q46002-2ED16EF8-3594-49E4-B785-6A58117AF0CD	Eleizalde L.	De la que mantuvo con Eleizalde, por ejemplo, el interés, que él fue uno de los primeros en despertar, por los nombres vascos tradicionales, interés que está lejos de haberse extinguido.
Q46006-07A7F186-D622-4A4E-8653-90471C660EB6	Elías de Tejada F.	Según Francisco Elías de Tejada, el reinado de Felipe II (y esto, de ser verdad, no es un dato que me llene de regocijo) es el momento en que aquel régimen es más respetado por la Monarquía, al tiempo que ésta es aceptada con entusiasmo por nuestros reinos, señoríos y provincias.
Q46018-E7EA28D2-4E41-4965-AA0F-C683EF729829	Elizalde F.	Nafarroan, zoritxarrez, eta arrazoibila hasi beharko dugu noizpait, ez ikasien arimen probetxuari begira zegoenik izan arren, ez zuten, halaz guztiz, hizkuntza jasotzeko lehia sutsurik agertu: ikus, adibidez, Beriain, Elizalde, argitaratuak zeuden eta argitaratzen ari diren dotrinak.
Q46025-50556DBA-6ECA-42A5-B7CC-2ED273F5BB8C	Elorza J.	Hay, evidentemente, otros hombres junto a Urquijo, más entregados algunos a la política que él, que juegan un papel decisivo: así don Julián Elorza, último presidente de la Sociedad.
Q46039-0FB5E4C0-F560-4BA0-8C48-9464C7AAD955	Engels F.	F. Engels, que trabajó en dialectología germánica (cf.
Q46039-0FB5E4C0-F560-4BA0-8C48-9464C7AAD955	Engels F.	Como equivocación, si todo es equivocado, la de Engels parece gigantesca al lado de la de Paul.
Q46046-63AC4430-69E1-422D-B03D-9EC6A2260207	Erkiaga E.	Bigarren eta hirugarren saria, Berasaluze eta Erkiagak eramanak, itzulpenentzat izan dira.
Q46047-7FA81C0E-D0F8-4175-B4AE-AF44C237F68B	Ernout A.	Ante un problema parecido, escriben Ernout-Meillet:5 «Est-ce le nom propre Gaius.
Q46047-B9A1EB41-503F-4586-B17A-775AF771B3C7	Ernout A.	: voir Ernout-Meillet, DELL, s.
Q46049-00063E42-3B15-4BA1-805F-13C052239FCF	Errandonea J.	Errandonea en todo momento: el lector menos atento lo ha de advertir al instante sin necesidad de que nadie se lo indique.
Q46049-00063E42-3B15-4BA1-805F-13C052239FCF	Errandonea J.	1 BAP 9 (1953), 283-284. Reseña de Juan Errandonea, «Analogías vascas en el vocabulario sumero-semítico», Anthologica annua 1 (1953), 225-299 (Iglesia Nacional Española, Roma).
Q46050-2421E989-7963-40B8-9F84-2510301DEDBA	Erro J. B.	No hay que escarbar mucho, en efecto, para encontrar algún texto por el estilo de éste, no recogido por Tovar, que procede de la contestación de don Juan Valera en la recepción pública de don Francisco de Paula Canalejas en la Academia Española, que no era «Real» en 1869: «Astarloa, Sorreguieta, Erro, Larramendi y el abate Iharce Bidassouet de Arostegui sostenían que el vascuence fue la lengua que se habló en el Paraíso».
Q46071-274EFDD8-5A47-4022-AD30-B6FE4DC1BB58	Etcheberri J. (de Sara)	Incluso se diría que la influencia o el contagio de Larramendi alcanzó ya a su contemporáneo Etcheberri, el de Sara.
Q46080-455AF3CD-A1C9-40A0-92B0-20E7B3FA4D95	Etxaide J.	gehienek ere badakite noski izengoiti horretan erdi estalirik dagoena Etxaide gaztea dela.
Q46080-455AF3CD-A1C9-40A0-92B0-20E7B3FA4D95	Etxaide J.	Etxaidez kanpora ere izan ditugu lan asmatuak: hala ohorezko aipamena irabazi duen Loidirena, luzaro gabe argitaratzekoa hau ere.
Q46770-F843E017-0A3E-495C-94DB-F965EF0A12CC	Lázaro Carreter F.	No se trata de un manual en el que se intenta exponer sistemáticamente la materia, ni tampoco de un diccionario, por el estilo de los bien conocidos, de contenido que rebasa más o menos los marcos de lo propiamente lingüístico, de Hamp, de Marouzeau o, entre nosotros, de Lázaro Carreter.
Q46776-AF40E5D6-4D43-4F5F-8DCB-02D55B9C65E4	Lecuona Manuel	7 Más cerca de nosotros está, como me recuerda don Manuel de Lecuona, el alavés y riojano garcía «zorro», cuyo origen es según toda verosimilitud el antiguo nombre y apellido actual García.
Q46790-2675AC49-B707-42C6-8296-F9CBB12389CA	Leizarraga J.	Orain bere «Index vocabulorum aliquot Cantabricorum» hori aztertzera bagatoz, aurki ikusiko da, agerian baitago, ez dituela, oker ez banago, bi iturburu besterik: berak aipatzen duen Leizarragaren Testamentu Berria eta, gainera, L. Marineo Siculoren Cosas memorables de España delakoan (edota, berdin dena, latinez De rebus Hispaniae memorabilibus deritzanean) datorren hiztegitxoa.
Q46790-49B35835-367E-44FC-B4B9-2C9C7ADF02F5	Leizarraga J.	horiak ‘esos [neutro]’ en Leizarraga, etc.
Q46790-C87805AD-D69F-4A97-94EC-9F5FCA718A8B	Leizarraga J.	Azalez, formaz, ekidin horrek badu harako euskara zaharrean maiz agertzen den -kidi- aditz laguntzailearen eitea: Mundu oro eztaquidic hura veçayn valia (Detxepare), ezlaquidigu deus probetcha (Leizarraga), etc.
Q46791-AAAF831B-E843-4611-98EC-49C445F239C8	Lejeune M.	Y era así como vi al releer la reseña de M. Lejeune, Celtiberica, BAP 12 (1956), 233-235, aquí  núm.
Q46791-AAAF831B-E843-4611-98EC-49C445F239C8	Lejeune M.	En AIWN, Sezione Linguistica, 5 (1983), pueden verse: Michel Lejeune, «Sur les nasales celtibères», 11-26, y Javier de Hoz, «Origine ed evoluzione delle scritture ispaniche», 27-61, en especial pp. 30 ss.
Q46800-049EF853-8735-4EF7-8096-5FFEC9002A6C	León Luis de (Fray)	Honako liburu honen iruzkina: Fray Luis León eta Donibane Gurutzen olerkirik onenak, erderaz eta euskeraz, Gazteluk autatuak eta itzuliak.
Q46802-3A0B72D9-145A-4DE1-90A8-C383888FE956	Leovigildo	Sería la huella de las incursiones vascónicas hacia el norte, de las cuales es particularmente conocida la del 587, que sigue inmediatamente a la fuerte presión que Leovigildo ejerció al sur y en tierras alavesas en particular.
