claim_id	entity	context
Q47780-831344F9-2FD9-406C-97B6-5632793CCC70	Trier J.	Entre las palabras que se podrían agregar —y lo personal, claro está, juega un papel decisivo en la elección— he anotado: Campo semántico (Trier, etc.
Q47781-D5143664-34DC-476B-B07A-07D889930BD7	Trombetti A.	Meillet,  reseña de A. Trombetti, Le origini della lingua basca, Bolonia 1925 , BSL 26 (1925),  272-273 , p. 273: «Dans les recherches de parentés de langues, il y a deux moments: le premier consiste à rechercher les rapprochements possibles à première vue.
Q47783-1A06B2CF-00BB-4D0A-B5D2-302932348F9D	Trubetzkoy N. S.	Ya R. Jakobson (apud Trubetzkoy, Principes de phonologie, Paris 1949), pp. 333 s.
Q47621-75D95D72-C8DE-4289-B862-A27A724B201C	Senn A.	Alfred Senn,  «Zur sprachwissenschaftlichen Methode» , en Sprachgeschichte und Wortbedeutung.
Q47625-A0529302-D8FA-4C1D-AE43-615AB657301D	Sertillanges A. D.	Maiz gertatu ohi da, izan ere, honelako liburuetan —susmo txarrak ez dagoenik ikusarazi ez badit— idazlea esanaren esanaz asperturik bezala mintzatzen zaigula, besteren ahotik entzuna hotz-hotzean berresaten, baina Villasante bero-beroan, su eta gar, mintzatzen da, ez Sertillangesgandik entzunaz, bihotz-barrendik datorkion etorri gartsuaz baizik.
Q47636-974984C9-1169-4F1A-84F5-DA58296C53C0	Sigurd B.	For a historical account, see Bengt Sigurd, «Generative grammar and historical linguistics», Acta linguistica Hafniensia 10 (1966), 35-48.
Q47648-B9D84822-5183-47C0-BA88-DCA1761A4278	Skinner B. F.	Oraindano esplikaziorik entzunena behaviorist direlakoena zen (Skinnerena, adibidez).
Q47666-F22E75EE-0133-4A47-B495-8E8834AF2F3A	Sorarrain G.	23-135 dituela dio Sorarrainen Catálogo-ak.
Q47668-49063670-90A0-463B-82B9-F05B201CB1E6	Soroa M.	El teatro vasco moderno nace en San Sebastián: más exactamente, la zarzuela bilingüe Iriyarena de Marcelino Soroa fue representada en Ciboure por un grupo de refugiados donostiarras en 1876, año en que nació allí Maurice Ravel.
Q47668-49063670-90A0-463B-82B9-F05B201CB1E6	Soroa M.	Soroa escribió también poesías y unos diálogos muy amenos.
Q47684-43BDF0DA-9F7B-4D5D-B4B0-A0BC86F2B351	Sponde J.	erdal idazle, haatik, Pío Baroja eta Jean de Sponde. Eskubide osoa dute, beraz, Zeruko argia-k eta Anaitasuna-k iragarkietan oihukatzen dutenean: Geu gara euskal prentsa.
Q47692-0B18A716-F28E-4326-B35D-26149D9E9661	Steinbeck J.	John Steinbeckek (eta gero, zinemaratzean, E. Kazanek) lasailasai erabili zuen East of Eden titulua, protestante giroko Biblia kutsuan haziak eta heziak izan ziren multzoentzat ari zelako: hango literaturan bestetan ere aurkitu izan dut aipamen baino imintzio areago izanik bidenabar ahotan hartzen den esaldi hori (aski dut harat, haruntz, eskuaz keinu egin, han dagoen zertaz ari naizen jakin dezazun).
Q47700-702596FE-1B8D-4E7A-BD7F-8A4047937B58	Stewart W. A.	Beste adibide jakingarri batzuk, eman eta gero, W. A. Stewartek hizkuntz sailkapenerako jarritako lau irizpide eman zituen Mitxelenak: 1) standard (norma izatea), 2) autonomy, 3) historicity, eta 4) vitality.
Q47701-0C19A574-183F-4449-9E39-9DC219F0BFDB	Stockwell R. P.	R. P. Stockwell y C. W. Barritt, «Scribal practice: some assumptions», ib.
Q47707-428FB3D1-9BDE-4EFA-8B8D-28FFAA6992B3	Sturtevant E. H.	Esto, unido a lo anterior, corrobora el rechazo de la hipótesis que ve el vizcaíno como una rama adyacente, aunque salida del tronco común, rama que, en unión con el conjunto de los dialectos ‘vascos’ (es decir, éuskaros sin vizcaíno), daría fundamento para la reconstrucción de un éuskaro-vizcaíno, comparable en el campo de las reconstrucciones al indo-hittita de Sturtevant. O, en un terreno más fácil de palpar, no parece haber razón para ver en el vizcaíno algo que se relaciona con los demás dialectos vascos a la manera en que el tsaconio se relaciona con los dialectos griegos modernos.
Q47711-C5EC968D-0F57-4874-9389-D48EB0A7064E	Suintila	» en nuestro país con referencia a Leovigildo y luego a Suintila. Es difícil discrepar de este principio de la diversidad de la tradición que viene arrastrando la lengua vasca para aferrarse a una continuidad ininterrumpida, libre de interferencias extrañas.
Q47712-F21AA68D-3304-45AA-8E8E-9BA788F3996E	Swadesh M.	M. Swadesh y su escuela en Méjico han empezado a utilizar «cognadas».
Q47715-38F6B84C-7B4B-496E-8A04-680198B7C723	Szemerényi O.	O. Szemerényi, Einführung in die vergleichende Sprachwissenschaft, Darmstadt 1970, p. 74: «Beim Verbum dagegen ist von einigen Ausnahmen abgesehen das alte System radikal geändert worden, indem der Akzent nach den äussersten Möglichkeiten des Dreisilbengesetz zurückgezogen wird;
Q47727-41F6A57B-D748-4143-8F86-D409E2776759	Tartas J.	Tartas eta Tartasen Onsa hilceco bidia dela eta, ibili da azken aldiotan zenbait zalaparta.
Q47727-532E4B7E-6AA5-4D62-A108-299F74FA1B00	Tartas J.	Galdegaiaren aurreratzea, topic fronting delakoa, Axular eta Tartasengan aurkitu du De Rijkek.
Q47727-A827FF88-1764-41D4-A366-51A9307E16D0	Tartas J.	Bestalde, zail amorratuak dira Tartas eta baita Oihenart bera ere.
Q47727-B7BBCB25-11D3-452B-B90A-ED2AA69262A1	Tartas J.	Eta Zuberoako Tartasen Onsa hilceco bidia-n honelako joskera nahi hainbat dugularik: «Gossiac ansa honquituric dagoenac» dakar, esate baterako.
Q47727-ECF9736F-6782-4018-9871-4430185D36BF	Tartas J.	Es todavía más suletino de habla, pero no del todo, Juan de Tartas que en una de sus obras, Onsa hilceco bidia («Modo de bien morir», 1666), reunió un buen montón de enxiemplos de toda laya, cosa más bien nueva en esta literatura.
Q47729-7E67968E-4708-4B41-8E63-F1B84828747D	Tauer N.	Norbert Taueren izena ongi hedatua dago, noski, euskaltzaleen artean;
Q47729-7E67968E-4708-4B41-8E63-F1B84828747D	Tauer N.	Tauer jaunari nolabait goratzarre egitearren, bere milagarren euskal eskutitzera heldu denean.
Q47729-7E67968E-4708-4B41-8E63-F1B84828747D	Tauer N.	Taueren izena eta luma ezagunak ditugu, baina ez dakigu guztiok hain zeharo noiz eta nola sortua den bere euskaraganako joera sutsua.
Q47729-7E67968E-4708-4B41-8E63-F1B84828747D	Tauer N.	Hona, esate baterako, nola azaltzen digun Tauerrek berak bere euskaltzaletasunaren jaiotza:
Q47729-7E67968E-4708-4B41-8E63-F1B84828747D	Tauer N.	Honako liburu honen iruzkina: Tauer’tar Norbert, Bere idazkiak, Buenos Aires, Editorial Vasca Ekin, urterik gabe [1962].
Q47733-A7721843-D7AE-4DD0-9AE2-890B64B674FC	Tellechea Idígoras J. I.	Tiene distintos libros, publicados los primeros en Salamanca donde fue profesor, y abundantes inéditos que ahora está publicando Tellechea Idígoras: téngase en cuenta que la Compañía de Jesús fue expulsada de España el año siguiente de su muerte, y sus papeles fueron decomisados.
Q47733-EE521E4E-6358-4FC0-8D88-B9FCA5A576AE	Tellechea Idígoras J. I.	11 Corografía  o descripción general de la Muy Noble y Muy Leal Provincia  de Guipúzcoa, published by J. I. Tellechea Idigoras, San Sebastián 1969, p. 301: «En Beterri son conocidos en Fuenterrabía por icusiricanen, oraindicanen, y así otros, por oraindic, icusiric;
Q47742-20FD1444-7086-4FFF-8938-A980C325AF13	Tertuliano	Entonces habría tenido aplicación más directa a nuestros problemas el aforismo, recogido por Etcheberri el de Sara, y que procede, como tantas otras sentencias redondas y un tanto sofísticas, y sentiría equivocarme, del gran Tertuliano: Quod apud multos unum inuenitur, non est erratum, sed traditum.
Q47743-860644CB-1B13-457B-8232-F7DA538EFDFE	Tesnière L.	Gehien saiatu direnak outsider batzuk (Tesnière, esaterako) izan dira.
Q47749-0F4A1965-FA80-44DF-9B49-26393C301FB4	Thurneysen R.	Como indicó Martinet, Économie, p. 258, es mucho mejor apoyarse en Thurneysen para describir las condiciones del fenómeno que en Lewis-Pedersen, que son cualquier cosa menos claros para quien no sepa exactamente de antemano de qué se trata.
Q45180-F541BFE6-BE12-4F38-A19A-6CCEF7286A7B	Domingo Aguirre	Campion, Aita Donosti eta Lhande, Arantzadi, Urkixo, Txomin Agirre, hezur eta mami dakartza gure aurrera.
Q45278-866E7956-2130-4693-AE61-38DF27FA6BC3	Ansola G.	Egan-eko zuzendarietakoak, eta Gurutz Ansolak argitara zituztenak ere.
Q45289-F9F48A82-14FB-4E74-BCCF-532DE66249BA	Añibarro P. A.	38 Añibarro da quiriquiolatza, de latz ‘áspero’, y López de Guereñu ha recogido quiriquio «exterior de la castaña» en Murua de Álava.
Q45292-40FBA0BF-FF3D-417C-BE15-201D401B5B9D	Apaolaza A.	Trueba-Apaolazaren Patxiko Txerren ezagunak edo, hobeki esan, behinola ezagun izanak merezi zuen gure egunotan laugarren argitaraldi bat: oraingoa, behar bezala, lehenari darraio, hurrengoetan agertu ziren «hobekuntzak» orrialdeen behealdean bazterturik.
Q45292-40FBA0BF-FF3D-417C-BE15-201D401B5B9D	Apaolaza A.	Argitasun ugari eta jakingarriak arras eskaintzen dizkigu gehienok ia izenez baizik ezagutzen ez genuen Apaolazaz.
Q45292-40FBA0BF-FF3D-417C-BE15-201D401B5B9D	Apaolaza A.	Txorakeria galanta litzateke, noski, Apaolaza Cervantesen edo Pérez Galdósen mailan ipintzea: Trueba bera ere, gaztetango oroitzapenak zuritu beharrean ari zen Unamunok besterik esan arren, urruti dabil hortik.
Q45292-40FBA0BF-FF3D-417C-BE15-201D401B5B9D	Apaolaza A.	Honako liburu honen iruzkina: [Antonio de Trueba] Antero Apaolaza, Patxiko Txerren, Tolosa, Auspoa, 1962.
Q45298-2E29B5CE-58DB-4D01-83DB-B2FBCE8F6A90	Apraiz O.	Odon de Apraiz adiskideari, euskaltzale kartsu eta euskalari trebeari, goratzarretan zerbait eskaini nahi eta eskaini behar niolarik, zorren kitagarri ez bada ere zorren ezaugarri legez bederen, ohartxo labur hau dakart hona.
Q45298-2E29B5CE-58DB-4D01-83DB-B2FBCE8F6A90	Apraiz O.	Homenaje a Odón de Apraiz. Odon de Apraizi omenaldia, Vitoria-Gasteiz, Consejo de Cultura de Álava, 1981, 259.
Q45303-7393DF78-405C-49D6-BCD8-0664148CDC2F	Arana J. I.	Según el P. J. I. Arana, este Catecismo está en vascuence vizcaíno occidental de Vizcaya y Álava, abunda en palabras castellanas, y debe ser anterior al Capanaga, opinión, esta última, que no comparte M. Vinson, principalmente a causa de la v media.
Q45305-429C78C0-D639-42F0-8A4B-BE516C0D2040	Arana Goiri S.	Oihenartek, berriz (ehunka urtez beranduago Arana Goirik egin zuen gisan), bere legeak sartu nahi ditu, nahiz lege horiek atzerrietako bertsogintzan maiz onartuak izan.
Q45305-4F82E009-AD9B-4A26-AF66-12C6085869A7	Arana Goiri S.	No extrañará, pues, demasiado que temas, autores y obras comentados por Tovar estuvieran ya tratados, en buena parte, aunque desde un punto de vista bastante distinto, por Andrés de Mañaricúa en su Historiografía de Vizcaya, Bilbao 1971. Como nota diferencial en la actitud podría acaso decirse que don Andrés, aparte del carácter histórico y vizcaíno (restricción que afortunadamente no practicó con demasiado rigor) de su libro, se inclinaría en principio, por esas razones que la razón no conoce (bueno, esto es una manera de hablar: ¡ya lo creo que las conoce!), por Sabino de Arana Goiri allí donde Tovar se inclina más bien por Unamuno.
Q45312-C09F8CF1-E2C3-4F91-943C-3C077EDDFE98	Aranzadi J.	J. Aranzadi, Milenarismo vasco, Madrid 1981, p. 328 n.
Q45313-1B49AF4E-8362-491F-9807-AD82FE2BE17F	Aranzadi T.	15 P. 257. 16 Apellidos vascos, San Sebastián 1953, p. 28. 17 Según Larrinúa, zapelaitza es «Buteo vulgaris» (T. de Aranzadi,  «Nombres vascos de aves» , RIEV 3, 1909, 160-167, p. 161).
Q45313-57260088-4B9F-4C6B-97E5-2FD6E09F4A20	Aranzadi T.	4 Frente a esto, lo poco que somos y tenemos en el orden cultural está cimentado en la obra de hombres como Urquijo, Azkue y Telesforo de Aranzadi, por no citar más que algunos nombres y reducirnos al campo que conozco mejor.
Q45313-57260088-4B9F-4C6B-97E5-2FD6E09F4A20	Aranzadi T.	a de Areilza, Bilbao 1964, p. 107 (carta a Aranzadi, 1905).
Q45316-1C131CD9-AFAD-439C-8CB7-74CDDE588CA6	Araquistain J. J. M.ª	En esta línea del interés por los dialectos vascos Añibarro se sitúa a continuación del Padre Araquistain, autor de unos preciosos Suplementos al Diccionario trilingüe y al lado del contemporáneo que compuso el llamado «ms.
Q45316-27D0A2E2-E8A2-49BE-B3AC-159AD5D3D8A8	Araquistain J. J. M.ª	de Araquistain. El análisis de ronc.
Q45317-42D47447-F1F6-46B8-B782-7D5B906D75B3	Araquistain J. V.	Mientras es demostrable que la batalla de Arrigorriaga, Jaun Zuria y lo demás, con variantes en los nombres y en los sucesos, ya andaban por escrito a principios del siglo XIV, el cantabrismo de los vascos, creencia a la que debemos desde el canto de Lelo hasta las Tradiciones vasco-cántabras (1866) de Araquistain más lo que sigue, nada tiene de tradición: nace o se muestra a la luz entrado ya el siglo XVI, como señala Mañaricúa, puesto que Lope García de Salazar en Vizcaya no lo conocía a fines del siglo anterior.
Q45324-44D39C8A-9AA9-471F-97F9-5E6F0AE75255	Areilza E.	Muchas cosas habían cambiado y otras muchas estaban a punto de cambiar, en el País y fuera de él, alrededor de 1900. De las banderillas de fuego que hace setenta años plantó en Bilbao Unamumo apenas queda aquí más que el recuerdo de una botaratada insigne: nadie se acuerda gran cosa, por ejemplo, de lo que Enrique Areilza bautizó maliciosamente como «los principios fagocitósicos del flexor sobre el aglutinante».
Q45324-44D39C8A-9AA9-471F-97F9-5E6F0AE75255	Areilza E.	4 Doctor Areilza, Epistolario, intr.
Q45324-44D39C8A-9AA9-471F-97F9-5E6F0AE75255	Areilza E.	a de Areilza, Bilbao 1964, p. 107 (carta a Aranzadi, 1905).
Q45325-013E6979-FFD0-4D4A-850F-F9D684D4E60D	Areilza J. M.ª	Muchas cosas habían cambiado y otras muchas estaban a punto de cambiar, en el País y fuera de él, alrededor de 1900. De las banderillas de fuego que hace setenta años plantó en Bilbao Unamumo apenas queda aquí más que el recuerdo de una botaratada insigne: nadie se acuerda gran cosa, por ejemplo, de lo que Enrique Areilza bautizó maliciosamente como «los principios fagocitósicos del flexor sobre el aglutinante».
Q45325-013E6979-FFD0-4D4A-850F-F9D684D4E60D	Areilza J. M.ª	4 Doctor Areilza, Epistolario, intr.
Q45325-013E6979-FFD0-4D4A-850F-F9D684D4E60D	Areilza J. M.ª	a de Areilza, Bilbao 1964, p. 107 (carta a Aranzadi, 1905).
Q45331-2F5F79BD-DA5A-4132-9514-08DB2779CA1B	Aresti G.	Horrelako zerbaiten bila, zenbat aldiz ez gara bildu, Aresti zena lagun, aditzaren batasunerako batzordean, Altuna genuela idazkari, sesio bizia zerigula batzuetan eta arrazoi baketsuetan igeri beste zenbaitetan, eta haraindiko ertzeraino inoiz igaroko ez ginelako beldurrez gehienetan.
Q45331-330AAD25-3807-4179-982E-B22876578AA4	Aresti G.	36 Las pastorales suletinas han vuelto a la actualidad, con ocasión de la reciente edición de Canico et Beltchitine o, mejor, del prólogo que le ha antepuesto Gabriel Aresti: Kaniko eta Belxitina,
Q45331-44A291E7-1204-4E4A-ABA8-0DD18288B8D4	Aresti G.	Esan didatenez, ez omen zion argitaraldi berri honi harrera onik egin Bilbon gaurko euskal idazleen artean gailen ageri den Arestik.
Q45336-735AC872-422B-4201-9A52-8EE3B5F8361E	Arigita Lasa M.	el padre Akesolo me recordó la existencia de un Olodogui en un documento medieval publicado por M. Arigita Lasa: diría que está incluido en su Colección de documentos inéditos para la historia de Navarra, Pamplona 1900, pero no tengo la referencia a mano.
Q45357-2AD352E3-CDAA-40CE-9FE1-2FF606E5994B	Arrese-Beitia F.	Hau dela eta, Arrese-Beitiaren bertsoak datozkit gogora, zuzen edo oker:
Q45365-04D17C57-581E-4CE8-9295-8A4BE9C9F918	Arrue A.	Hor agertu ziren baita Antonio Arrue zenak (G.
Q45370-9B2F19DC-CB23-435D-B2E6-7D1BD60C3DC3	Artetxe J.	Behar duen aurkezpena, gainera, zentzuz eta neurriz egina aurkituko duzue Joxe Artetxek itzulpen honi ipini dion hitzaurre atseginean.
Q45372-A0F58CAF-DB94-4294-98EF-28E6A824181B	Artola F. (‘Bordari’)	Sin embargo, no hace mucho tiempo que he sabido, no sin sorpresa, de boca de mi buen amigo Fernando Artola, que kaudan o kaudana con ese valor es de uso corriente en Fuenterrabía.
Q45389-6CC7298E-019F-41D2-959B-DBAFDD0A7378	Astarloa P. P.	No tanto, en cuanto a Astarloa. Hoy sabemos mejor lo que G. de Humboldt pensaba de éste.
Q45389-8AABFF8F-B00D-4FDC-BC49-291276FF89E3	Astarloa P. P.	No hay que escarbar mucho, en efecto, para encontrar algún texto por el estilo de éste, no recogido por Tovar, que procede de la contestación de don Juan Valera en la recepción pública de don Francisco de Paula Canalejas en la Academia Española, que no era «Real» en 1869: «Astarloa, Sorreguieta, Erro, Larramendi y el abate Iharce Bidassouet de Arostegui sostenían que el vascuence fue la lengua que se habló en el Paraíso».
Q45389-D54103E4-3EE2-4F25-B0ED-3BAE2CA0C9D0	Astarloa P. P.	Il y a beaucoup à dire en faveur des travaux linguistiques de Larramendi, d’Astarloa, d’Ithurry, d’Azkue, premier président d’Euskaltzaindia, et de tant d’autres dont les noms sont peut être moins divulgués.
Q45394-B04902E3-BE94-43C3-925D-6F72B13FA11A	Asurmendi F.	Eguitade icusgarri au eguin izan ceban Don Francisco Asurmendi Guipuzcoatarrac, icen andico Don Ventura Rodriguezen buruz;
Q45395-9341D598-36BF-4821-B53E-C5801D7DB132	Ataun B.	kal-irakaspidea, San Sebastián 1932, agotado hace años, de los PP. Arrigaray y Ataun. Las formas verbales citadas son, claro está, guipuzcoanas en lo fundamental, con un ligero matiz de Goyerri en los casos en que el uso literario está menos unificado.
Q45395-9341D598-36BF-4821-B53E-C5801D7DB132	Ataun B.	Este libro resultará útil en muchos aspectos, sobre todo mientras siga faltando de las librerías el Arrigaray-Ataun que tantos servicios ha prestado a muchos, aunque no quizá a los principiantes.
Q45395-9341D598-36BF-4821-B53E-C5801D7DB132	Ataun B.	Bonifacio de Ataun, Gure aditza.
Q45409-130458CA-230C-4B4F-A32D-AC7B6C9A6491	Axular P.	Entre las denominaciones vascas del ‘erizo’, animal de mal agüero entre nosotros, hay un oriental sagarroi, ya en Axular y en Pouvreau, sobre el cual nada tengo que decir por el momento, excepto que a primera vista recuerda a sagar ‘manzana’.
Q45409-130458CA-230C-4B4F-A32D-AC7B6C9A6491	Axular P.	Larramendi, que de oídas sólo debía conocer triku, leyó el primero seguramente en Axular, p. 78: el pasaje lo he copiado, por muy otros motivos, en FLV 3 (1971), p. 167.
Q45409-130458CA-230C-4B4F-A32D-AC7B6C9A6491	Axular P.	Hay, con todo, una palabra de procedencia nunca debatida, el nombre del ‘mono’, en que se da la misma alternancia -i(n)o / -u: tximino se da tanto en vizcaíno como en suletino, ximino tanto en Axular como en el bajo-navarro
Q45409-A257DCF9-21DC-4FA7-BC36-3A5FD14A90CC	Axular P.	Ez diot deus kenduko bere hitz-etorri eta hitz jarioaren orrazketari, antzinakoen segizioko baita arlo horretan, inor baldin bada: hots, Axular, Larramendi eta gure arteko beste hainbesteren segizioko;
Q45409-A61813BA-38FE-404C-9DF0-9D009CEEF3AD	Axular P.	Ez zait hori gertatzen, esate baterako, Axularrekin.
Q45421-2A15F349-B06A-4CB4-927D-753478F043E0	Azkarate R.	Honako liburu honen iruzkina: Ramos Azkarate, «Galtzaundi» ta beste bertso asko, Tolosa, Auspoa, 1962.
Q45445-A32BADF6-64F3-4C95-A7C9-1A82647BADFA	Bähr G.	En todo caso las objeciones que opone G. Bähr no me parecen definitivas.
Q45445-B5C8947F-6E89-4586-8CEA-DF098531BFA9	Bähr G.	lo(h)i, logi «sucio, lodo, pantano», con algún derivado en este último sentido, como ya hizo G. Bähr refiriéndose a Loúgeon hélos, etc.
Q45445-C3D7BB76-FE68-4930-90ED-A89B8515DB61	Bähr G.	a2 Merecen mención aparte en el terreno de la morfología verbal, para los años anteriores a 1936, los datos que, recogidos en el área de habla guipuzcoana, fueron publicados por G. Bähr, RIEV 21 (1930) ss.
Q45428-1416774C-F77B-49A2-9096-333CAE24C1B5	Azkue R. M.ª de	Il y a beaucoup à dire en faveur des travaux linguistiques de Larramendi, d’Astarloa, d’Ithurry, d’Azkue, premier président d’Euskaltzaindia, et de tant d’autres dont les noms sont peut être moins divulgués.
Q45428-31336D33-C424-416C-A361-A5EC40927C32	Azkue R. M.ª de	Estamos, más o menos, donde nos dejaron Bonaparte y Azkue, sobre todo, en un punto razonablemente avanzado para aquellos tiempos, pero que ya no lo es para los nuestros.
Q45428-5196D296-9312-497F-8D42-AE5DE7B7104D	Azkue R. M.ª de	giztin-gaztaiña (que signifie giztin?), Azkue cite itxasgaztaiña (vo gaztaiña, i.
Q45428-5735F33E-E9E3-4AED-B5FB-D20447B269D0	Azkue R. M.ª de	28), que parece habrá que explicar a partir de *arri-lasta por asimilación, hay también, según Azkue, vizc.
Q45428-5735F33E-E9E3-4AED-B5FB-D20447B269D0	Azkue R. M.ª de	ya advertía Azkue (Diccionario, s.
Q45428-5735F33E-E9E3-4AED-B5FB-D20447B269D0	Azkue R. M.ª de	Quedaría por aclarar el útimo elemento de zot(h)al, para lo cual podría servirnos (h)utsal «vano», derivado de (h)uts (el único aceptable entre los citados por Azkue) y acaso también argal «débil, claro, ralo, transparente», si como es posible procede de argi «luz, claro».
Q45428-728C7D0D-DEDA-4303-8448-D02AAC32C5C9	Azkue R. M.ª de	4 Frente a esto, lo poco que somos y tenemos en el orden cultural está cimentado en la obra de hombres como Urquijo, Azkue y Telesforo de Aranzadi, por no citar más que algunos nombres y reducirnos al campo que conozco mejor.
Q45428-728C7D0D-DEDA-4303-8448-D02AAC32C5C9	Azkue R. M.ª de	Su obra personal ha tenido continuidad en los tres casos: ésta está patente respecto a Azkue, a pesar de algunos altiba
Q45428-906F1C2F-B073-4A84-8C17-7B28C93C4448	Azkue R. M.ª de	3 Puede muy bien tratarse de eia (Azkue anota ei), cuyo valor moderno es ‘pocilga’, más urri ‘escaso, etc.
Q45428-A97A2FC0-D420-4B04-95DB-34E45968384B	Azkue R. M.ª de	15 En una ocasión propuse una etimología claramente errónea de sapelatz,16 variante registrada por Azkue además de zapelatz, etc.
Q45428-ADCDE7ED-E439-47FB-B633-A07949CFB9BB	Azkue R. M.ª de	Es cierto que Azkue procedió a principios de este siglo a una revisión crítica, pero esta revisión, según he indicado en otro lugar (véase Euskera 6, 1961, pp. 13 ss.
Q45428-ADCDE7ED-E439-47FB-B633-A07949CFB9BB	Azkue R. M.ª de	En efecto, puede demostrarse en más de una ocasión que voces de Larramendi a las que Azkue no dio entrada en su Diccionario, sin duda por creerlas manufacturadas por el jesuita, son totalmente auténticas, como acreditadas en fuentes anteriores y por lo tanto independientes de él.
Q45428-ADCDE7ED-E439-47FB-B633-A07949CFB9BB	Azkue R. M.ª de	Azkue pecó por defecto cuando, al cerrar con ostentación todas las puertas del diccionario al peligroso Larramendi, le dejó varios portillos mal atrancados por los cuales éste pudo colarse, aunque fuera bajo muy distintos disfraces que le hacen difícil de reconocer.
Q45428-CC6CAC91-888E-4DD1-BCAA-25E0C86DD90D	Azkue R. M.ª de	belaun-txoko (= belaun-azpi, belaunpe) «corva», aunque según Azkue hay ronc.
Q45428-EA4CA48D-A072-4FC3-B05C-D0B710B1331C	Azkue R. M.ª de	a de Azkue, con ayuda después de la Academia de la Lengua Vasca, fundada en 1918.
Q45428-F2899ACA-A443-49FF-857D-1F29E03C2C7F	Azkue R. M.ª de	Pero sabemos que don Resurrección María de Azkue tuvo en sus manos un ejemplar, aunque incompleto al parecer, y que «una reproducción estereotipada se conserva en la Biblioteca de nuestra Corporación»,2 es decir de la Academia de la Lengua Vasca.
Q45431-55E0508D-5B54-4567-8258-52551C175013	Azpillaga J.	Guztiok dakizue hauek Azpillaga, Basarri, Uztapide eta Xalbador izan zirela.
Q45458-EC1374A9-15B4-4131-8054-81AF05C2C7D7	Balparda G.	27 Hay unas palabras de don Gregorio de Balparda que merecen un breve comentario porque parecen tener eco reciente en medios más bien inesperados.
Q45458-EC1374A9-15B4-4131-8054-81AF05C2C7D7	Balparda G.	Es difícil evitar la conclusión de que, por cercanía en el tiempo y por lejanía en la pasión, el convencional, cuyas palabras iban a ser repetidas y amplificadas poco después por un observador tan agudo y ponderado como Guillermo de Humboldt, es más digno de confianza que Balparda. 28 Me cuesta resistirme a la tentación de copiar las palabras de Esteban Bilbao, el más subido ejemplo de elocuencia y de calor —destinado a menguar antes de mucho— en aquellos actos.
Q45737-182C5FCF-5BAD-4209-A32C-E1446D83E09E	Castaños Garay F.	P. S. Gogoangarri da, gorago esan ez bada ere, Tovar izan zela Florentino Castañosek Madrilen aurkeztu zuen tesiaren zuzendari: La formación del plural en la lengua vasca.
Q45737-BFAD8153-DC7E-488A-BA58-79C009719DE0	Castaños Garay F.	Florentino Castaños Garay, La formación del plural en la lengua vasca
Q45742-74B45991-20B6-4E5E-9509-A8FC2369080E	Castro A.	La hipótesis de A. Castro (RFE 20, 1933, 60-61)a2que ve en vasc.
Q45742-866D431C-5FB9-4B1E-85E4-A3521FFFFE46	Castro A.	22 En él leemos que Unamuno, y antes que él Adolfo de Castro, trataron de explicar la paradoja literal suponiendo una confusión del original kámilos «cable» o «calabrote» con kámêlos «camello», debida al iotacismo, es decir a la pronunciación griega tardía de ê como i.
Q45750-0C15A88D-9034-4681-B7D5-44AE45BF3627	Cejador y Frauca J.	La voracidad indiscriminada, muy superior a sus medios de fortuna, de don Julio Cejador y Frauca que, aunque decidido a no hacer el menor caso de ello, quería con todo enterarse del pensamiento «moderno» en materia de lengua, le movió a adquirir esas obras venerables de los patriarcas de la lingüística comparada (Bopp, Diez, etc.
Q45750-0C15A88D-9034-4681-B7D5-44AE45BF3627	Cejador y Frauca J.	Apenas puede caber duda ahora de que, con independencia de las cuestiones de otro orden que pudieron separarles, Urquijo estaba en lo justo al rechazar, por razones intrínsecas, los trabajos lingüísticos de Cejador, uno de los más preclaros ejemplos de eso que ahora llaman celtiberismo, aunque él fuera ilergete de nacimiento, en el orden cultural.
