claim_id	entity	context
Q46838-E38BD88C-C1AB-4015-B25C-B6FF247D335F	Lizarraga J. (de Elcano)	Those who are prone to the written letter have at their disposal, not to speak of Leiçarraga, d’Urte or Larramendi, the published and unpublished works of Lizarraga de Elcano (last quarter of the XVIIIth century), unmatched landmark in the history of High-Navarrese accentuation.
Q46858-52CEBF15-D429-454B-8C29-A53C79152400	Lohmann J.	Elogios intempestivos a Marr, como el de J. Lohmann,30 no pueden ocupar el lugar de los métodos de que hoy disponemos.
Q46869-3A95B9FC-1636-43EF-9256-A68766FB4CB7	Longacre R. E.	R. E. Longacre,  reseña de M. Swadesh, Mapas de clasificación lingüística de México y las Américas, México 1959 , Language 36 (1960), 397-410.
Q46870-75901B83-ACB2-4A9B-A19A-C3CD65B630D6	Lonjinos (bertsolaria)	Ezagunak ditugu ere Xenpelarren «bertso aldrebesak» Juxto eta Lonjinos hala-holako bertsolariekin izandako desafioan.
Q46873-01E607F0-E2B6-4AB6-9B47-04D3855840F7	Lopetegi L.	ezin dezaket esan lehen bezala aski merke argitaratuak daudenik, baina argitaratuak daude Retanarenean eta badute aurretik aita Leon Lopetegi jesuitaren aurkezpen bat eta hor aita Lopetegik oso ongi azaltzen du zergatik ez zen aita Kardaberatzen San Inazioren bizitza hemezortzigarren mendean agertu, joan den mendean baizik, seguru aski aita Aranak agerrarazia.
Q46890-776D246A-5BBA-4EE8-B309-C0A3CA3BAFD1	Luchaire A.	La razón de la conversión está sobre todo en las publicaciones de un historiador, Achille Luchaire, que, además de hacer la historia de la lengua vasca en períodos decisivos, nos enseñó cómo hacerla a los demás, sobre todo por lo que se refiere a la Antigüedad y a la Edad Media.
Q46890-776D246A-5BBA-4EE8-B309-C0A3CA3BAFD1	Luchaire A.	G. Lacombe, RIEV 2, 1908, 808-809),f no siempre bien acogidas por los vascólogos, Luchaire probó más allá de toda duda razonable la continuidad entre aquitano y vasco medieval y moderno.
Q46890-776D246A-5BBA-4EE8-B309-C0A3CA3BAFD1	Luchaire A.	d 29-33, 53-69, 166-170, 267-275. e 181-220. f «Achille Luchaire».
Q46892-2E1DB664-02DF-4B14-91AE-FE4395EA3B30	Lüdtke H.	A propósito de ellos y de algunos más, D. Alonso (p. 7), discutiendo ideas de H. Lüdtke, se manifiesta de la siguiente manera: «No parece caber duda de que de todos los sistemas vocálicos que hemos mencionado, el más arcaico es el B, común al sardo y a la zona fronteriza lucano-calabresa, ni que a éste debe seguir en antigüedad el rumano (la apertura de i > e sería, por tanto, más temprana que la de u > o).
Q46894-478D4CBC-1CDD-4342-91C7-2D414418CEA8	Luis XIV	gero Luis hamalaugarrenak, hemen lehen gertatu zen bezala, dena berriz hondatu zuen arte.
Q46903-01BC4D34-946D-4ECB-910D-C70816E777AC	Lyons J.	Lyonsek classical fallacy deritza.
Q46962-FF8F7685-D040-4222-B518-F19FBA452CBD	Marchand J. W.	Marchand, pp. 245 s.
Q46972-97E403CD-CD34-4AA6-BB4B-275874E94B2E	Markov A. A.	esango edo idatziko duen), erabakitzeko: Markoven katea edo.
Q46975-3A019508-3506-4CBF-A1D5-D4239DEA2E70	Marr N. J.	Elogios intempestivos a Marr, como el de J. Lohmann,30 no pueden ocupar el lugar de los métodos de que hoy disponemos.
Q46988-4D29002A-6B40-41F6-AB1E-6D230F014D27	Martinet A.	eta Martinet jauna gutartean balego monemak esan beharko), hizkera diferenteetako hitzen artean, zenbait kidetasun ageri dira.
Q46988-B095EB66-6B80-4194-90AB-0A50A46013DA	Martinet A.	Lo que pasa es que Lane emplea «condición» como sinónimo de contexto, o sea que se limita a lo que Martinet (1955, pp. 13 ss.
Q46996-B4EFDFD9-282C-485E-A97E-A218BDA25CCE	Marx K.	Non izan ditu Krausek etxean aurkitu ez zituen ondorengo irmo eta ugariak? Non nagusitu da integrismorik integristena Vaticano Bigarrenaren bezperan, Espainian izan ezik? Non agertu da Marx oraindik orain, jaio berria balitz bezala, lehen, gerraurretik, hainbeste «marxista» izeneko izanik, Araquistainek, Rozas-ek eta beste hiruzpalauk baizik irakurri ez zutena? Baserrian bizi denak nekez jakiten du hirietan gertatzen denaren berri.
Q47009-AF6CC009-5A88-435D-B5DB-8AB9EDF18BC2	Mauthner Fr.	Mauthnerek esaten zuen Aristoteles griegoz mintzatu beharrean dakotarrez mintzatu izan balitz bere kategoriak erabat bestelakoak izango ziratekeela.
Q47010-9CFCE770-D92E-4CB3-8653-054B4805755A	Maxwell J. C.	Podríamos invocar también al demonio de Maxwell que abre la puertecilla cuando ve acercarse una molécula rápida y la cierra al aproximarse una partícula lenta.
Q47181-30699858-4CED-4315-BC86-56B16094EC5C	Oihenart A.	Bestalde, zail amorratuak dira Tartas eta baita Oihenart bera ere.
Q47181-791C69F0-5B6D-49BF-A66B-1B98E04A079D	Oihenart A.	Con todo, Oihenart (1592-1667), suletino, era unos 25 años mayor que el padre Moret (1617-1687), cronista del reino de Navarra, y sabemos que la relación entre ambos no estuvo del todo libre de fricciones, debidas sin duda en parte a lo que Larramendi llamaba «pasión nacional».
Q47181-791C69F0-5B6D-49BF-A66B-1B98E04A079D	Oihenart A.	Veamos, si no, una muestra representativa de la opinión que Oihenart sustenta.
Q47181-867B2890-9CA4-4E1D-A964-3A90E5DB1EA4	Oihenart A.	Etxeparek, Oihenartek esan bezala, bi edizio izan zituen hasieran, bai Bordelekoa, ezagutzen genuena, eta bai Garibaik Erroan esaten zuen hirikoa.
Q47181-87CA5B4D-62D9-40EC-AF2A-3097AABB62C3	Oihenart A.	Besteak beste (eta besteei ez die inork erantzunik eman galdera nik duela hogei urte egina dudalarik), zergatik eraman behar dute ontziek (ipsae ontziak dira, noski) Etxeberriren izena? Hau zutelako jabe, eta kito? Barrutiarenaren planta tristea aipatu berria dut, eta aski egokia dirudi Zalgizeko jaunaren errefrauen aldamenean (edota Oihenartek eskuz idatzia utzi zuen atsotitzen bilduma-aurrekoaren ondoan).
Q47184-2C6C9D78-C23B-4106-BA7D-5CD368563FD1	Olabide R.	Diodan bidenabar hizkuntza hori, ez badirudi ere, arras ezaguna dela, guztiok guti edo gehiago erabili duguna, horrela jokatzen baitugu parentesisak (Olabideren taketak) ipintzen ditugun bakoitzean: (.
Q47203-F4F758BE-EC9E-4E00-8A8C-C3C7452E3BF4	Omaetxebarria I.	Ez giputz aditz klasikoaren alde (ez naiz orain hasiko bat ala bi diren aztertzen), baizik eta azken urte hauetan ongi ala gaizki erabili denaren alde: nonbait bestetan baino ederkiago ageri baldin bada, Aita Omaetxebarria (bizkaitarraren) liburu ezagunean izan da.
Q47206-0D35BC47-82FE-4914-B262-35F45BDDFFA6	Oñatibia J.	10 One of the points studied by Jacobsen, Oyarzun, after the spee ch of Jon Oñatibia, lies on the borderline of this area, but outside of it.
Q47220-5133BEFD-B393-4B5E-8CFC-D2EA0EB23DA7	Ortega y Gasset J.	Kultura molde honetan, Don José Ortega y Gassetek eta Revista de Occidente delakoak hain begiko duten kultura mota honetan, gakoa eta giltza kultur ahaide eta kultur lehengusuak (izter-lehengusuak izan arren) ezagutzean dago.
Q47234-020049B6-56E0-4630-A50B-FA9C380EC790	Oteiza J.	Ingelesez ere badugu adibide ezagunik (behiala Oteiza liluratu zuen exenplu bipila) Chomskyk emana: Colorless green ideas sleep furiously (euskaraz, «ideia berde eta koloregabeek lo egiten dute eriosuar», edo honelako zerbait).
Q47239-2C3C76B7-7B4D-4881-B294-9E095245692D	Ovidio	19772, I, 362, «Euscaldúnac» derizten bertsoak Ovidioren itxurara moldatuak Bonaparteren eskuz:
Q47249-825F11C2-2435-4E98-955C-1285C4352B97	Palmer L. R.	L. R. Palmer, The Latin language, Londres 1955, pp. 219 ss.
Q47527-51102EF3-97D8-43C2-93BE-355B4BB0FD6A	San Vicente de Paul	Saint-Cyran y con San Vicente de Paúl.
Q47534-364FF1BD-86BC-4867-9D96-C338E9CA5737	Sánchez de las Brozas F. (‘El Brocense’)	Ezaguna da, gainera, XVI. mendean, Francisco Sánchezek, «el Brocense» delakoak, sartu zuen ziri hura: «Qui latine garriunt, corrumpunt ipsam latinitatem».
Q47534-8C436BBF-B17E-4953-B1F4-5603188726A4	Sánchez de las Brozas F. (‘El Brocense’)	Sintasia, berriz, oraingo zenbaitentzat (eta XVII. mendeko Sánchez de las Brozasentzat) gramatika osoaren pare dena, erromes eta umezurtz ageri da sarriegi: ez duzue, diodanaren lekuko, Ithurryren Grammaire basque zabaltzea besterik.
Q47541-BB23124C-D629-4723-A735-A9DC773C2F09	Sánchez Ruipérez M.	De aquí el valor de la teoría de Saussure sobre los «coeficientes sonánticos» o, en morfología, de las ideas de M. Sánchez Ruipérez sobre la forma indoeuropea de las desinencias medias primarias.
Q47565-086BC615-8764-4504-8EEA-5ABB78A145CA	Sarasola I.	Ez dut uste, ordea, inork, liburu horietan, Ibon Sarasolarena salbu, erabateko iritzirik azaltzen duenik.
Q47565-807DA21B-ADA4-43FC-A15B-AB3C08CDFA5F	Sarasola I.	Sarasolaren Euskal literaturaren historia argitara zeneko hartan, cartesiano baino barthesianoago dugun iritzi-emaile ezagun batek, liburu hau goretsi ahala, izan zituen aitzindariak beheratzen zituen.
Q47256-84691542-2D35-4369-A48C-BEA3022D5A14	Pareto V.	Gogoeta horren iturburuak (Saussurek Pareto eta beste zenbait ekonomistagandik, dirudienez, hartu zituenak) Larresorok ez ezagutzea.
Q47261-668B0E28-1BD3-40FE-A583-198E8CE2E594	Pascual Pérez Ch.	de John Tynan y Charo Pascual Pérez, con un prefacio de Joaquín Gorrochategui.
Q47267-302FFD9B-72C0-4CDD-B5DA-B44803B83935	Pedersen H.	Como indicó Martinet, Économie, p. 258, es mucho mejor apoyarse en Thurneysen para describir las condiciones del fenómeno que en Lewis-Pedersen, que son cualquier cosa menos claros para quien no sepa exactamente de antemano de qué se trata.
Q47267-63EFA65D-7B78-4A3F-8421-2003B47171D7	Pedersen H.	Correspondencias cruzadas de contornos mal dibujados son las que han servido para la restitución de tres órdenes de oclusivas dorsales indoeuropeas: suponemos ahora que los tres resultados diferentes en albanés, supuestos por Pedersen y por Pisani,16 no están bastante demostrados y que, por lo tanto, como dice Kuryłowicz,17 «aucune langue historique n’a conservé les trois articulations».
Q47267-63EFA65D-7B78-4A3F-8421-2003B47171D7	Pedersen H.	16 H. Pedersen, «Die Gutturale im Albanesischen», Zeitschrift für vergleichende Sprachforschung 36 (1900), 277-340;
Q47275-D65CFD9F-F9BF-45F6-BC99-2F334EB25AC0	Pensado J. L.	Por amigos y colegas como Antonio Tovar, Emilio Alarcos, Fernando Lázaro o José Luis Pensado, sabía de la amabilidad y paciencia del oyente norteamericano (aunque, por aquello del melting pot, no todos fueran en este caso estrictamente norteamericanos, ni siquiera americanos), pero, por una vez, las ponderaciones ajenas quedaron más que confirmadas por la experiencia personal.
Q47292-13CF116E-150F-4E9A-9413-F155A53BDDDD	Pérez Galdós B.	XIX. mendeko idazle bat hartzen baduzue, Balzac, Dostoyevski, Pérez Galdos edo beste, kontalariak, lehen pertsonan mintzatzen ez bada ere, badaki, Jainko ttiki baten pareko, obran agertzen dituen pertsona guztien barrunbeen berri: zer uste eta zer nahi duten zer egiten duten bezain ongi.
Q47297-1B79EF35-7155-4DF9-94A3-626BB5467B3B	Pericot L.	Hasta la ‘comunidad pastoril pirenaica’ del neo-eneolítico de que hablaron autores como Bosch-Gimpera o Pericot, por no mencionar a los de casa, se pierde en una lejanía inaccesible.
Q47310-565B073F-3061-4CCF-8BA8-842F08DFB757	Piaget J.	Aski da, ene iritziz, Piageten Le structuralisme liburuxka aipatzea diodana frogatzeko.
Q47322-14C18A84-8BB4-4A4A-A74E-75F45D92279E	Pisani V.	otro tipo de reduccionismo (Ernst Lewy y sus seguidores, el V. Pisani de Geolinguistica e indeuropeo,  Roma 1940 , etc.
Q47322-B50039F6-E1AE-4FA2-93B2-F8048A490709	Pisani V.	Correspondencias cruzadas de contornos mal dibujados son las que han servido para la restitución de tres órdenes de oclusivas dorsales indoeuropeas: suponemos ahora que los tres resultados diferentes en albanés, supuestos por Pedersen y por Pisani,16 no están bastante demostrados y que, por lo tanto, como dice Kuryłowicz,17 «aucune langue historique n’a conservé les trois articulations».
Q47322-B50039F6-E1AE-4FA2-93B2-F8048A490709	Pisani V.	Pisani, 1961, pp. 11 ss.
Q47329-A30E2AD6-3F93-4874-AD94-75E1D09D3AB3	Placer E.	En el momento en que iban estas líneas a la imprenta, me ha llegado —veloz, como todas las malas novedades— la noticia de la muerte de Eloy Placer, compañero de armas y letras, que tanto hizo aquellos días para que nuestra convivencia fuera la más grata posible.
Q47333-89BD4ABB-F96C-4390-8B46-FEBC262F5A31	Plauto	Aipatu ohi den Plautorenaren gisa: Cras petito (etorkizun), dabitur;
Q47338-B2E1510B-445C-4293-8893-612EE6A26E41	Pokorny J.	Es un hecho, en efecto, que en el indoeuropeo que podemos llamar clásico, aun sin citar rarezas como la nasal velar, /s/ tenía una variante [z] ante consonante sonora: mizdhó-, nizdo- y ozdos aparecen todavía en el IEW de Pokorny. Ciertos «fonemas» que se restituían tras oclusiva dorsal (para irl.
Q47339-B35A13F7-7E34-48EC-889C-2B78AC5A703D	Polák V.	En un campo peor explorado, el de las lenguas kartvélicas (caucásicas meridionales), Václav Polák19 emprendió un auténtico tour de force cuando de la comparación del georgiano, mingrelio y lazo (sin el svano), con cinco vocales cada uno, intentó restituir un proto-sistema de diez vocales, análogo al del latín.
Q47346-E2456B1E-6B07-4F2C-9116-62466DBF20D6	Poppe N.	3 La posibilidad de descuidar, a partir de cierta distancia, la distinción entre formas heredadas y préstamos, siempre que puedan establecerse buenas ecuaciones etimológicas, ha sido aprovechada explícitamente por N. Poppe4 en un campo sobre el cual no podemos opinar.
Q47347-ED1D7187-0134-42D2-A918-5CD438B3BFF2	Popper K.	jakite enpirikoetan ez da sekula behin-betiko egiaztatzerik, Popperek erakutsi duenez;
Q47358-710B6A10-FAEB-4A58-86DD-E849169AA05F	Pouvreau S.	Horrela, euskal idazle genuen Silvain Pouvreau;
Q47373-DA1B705F-4788-4397-868A-FE6E37404045	Prudhomme S.	Zenbait idazle elkorrak gertatzen dira sail horretan, horrelaxe «Lizardi» (Sully-Prudhommeren aipamen aitortuaz kanpo)b3eta horrela, beste alor batean, aitzindarien artean Whitney baizik aipatu ez zuen Saussure.
Q47381-BCDA4AF0-8D0B-45BD-ABA7-CA6598DD792B	Pulgram E.	Antes de continuar, es menester salir al paso de una objeción fundamental, presentada por Ernst Pulgram (1961), crítico agudo y severo de los métodos usuales de reconstrucción, quien con su crítica les sirve mucho mejor, como suele ocurrir por lo general, que con la ciega sumisión.
Q47381-BCDA4AF0-8D0B-45BD-ABA7-CA6598DD792B	Pulgram E.	Pero la pregunta de Pulgram es otra y de muy otro momento: ¿es que un comparatista, privado de las luces de la historia externa, podría saber cuál de dos estados de lengua que poseen formas emparentadas es más antiguo y cuál más moderno? Él se inclina resueltamente por la respuesta negativa (p. 21): «if we knew only Latin and Italian, for example, and nothing else about the other Romanic languages or the history of the Romania, there would be nothing inherent in the records of these two languages as we have them to dissuade us from regarding them as contemporaneous related dialects rather than as mother and daughter language».
Q47395-EFA21303-96EB-4632-A4D9-D2E6C58D617B	Rask R. C.	Nolanahi den, 1800ean Raskek eta Boppek Hizkuntz konparazio (Lingüística comparada) delakoaren zimendarria jartzen dute.
Q47406-725E2363-DD06-46B1-8328-959D49BBB269	Refranes y Sentencias	Refranes y Sentencias-etakoak, Darmstadt-en zeudenak, hizkuntzalari
Q47406-A7306E31-6143-45E4-9133-B309950A2D3E	Refranes y Sentencias	Esta nueva publicación de la Cátedra Manuel de Larramendi presta, como las anteriores, un valioso servicio a nuestros estudios al poner a disposición de todos en forma fácilmente manejable el vocabulario de los famosos Refranes y Sentencias publicados en Pamplona en 1596, preparado por don Juan Gorostiaga cuya insuperable competencia en lo referente al dialecto vizcaíno es conocida por todos.
Q47406-A7306E31-6143-45E4-9133-B309950A2D3E	Refranes y Sentencias	Es también consecuencia del pequeño volumen de esta publicación el que las palabras vascas sólo vayan acompañadas de la traducción castellana que figura en los mismos Refranes antiguos.
Q47406-BFEC9AA8-B4B9-4E8C-A8FA-D245DF2863FC	Refranes y Sentencias	o 2. La explicación de ytuten (en los Refranes y Sentencias) como posible variante de du- «haber, tener», dentro de los casos de alternancia entre sorda y sonora, es altamente sugestiva.
Q47422-C1863CA9-665A-4422-A31A-E6A2D02AB0FD	Ricci S. de	El hecho es, si usamos otra fórmula, que Schuchardt, como nosotros, disponía de nombres aquitanos, pero no de textos en lengua del país: eran con todo de aire tan peculiar que otros, por ejemplo Seymour de Ricci a comienzos de nuestro siglo o Joshua Whatmough (The dialects of ancient Gaul, ·Cambridge Mass.
Q47430-321F1078-4684-468D-8F4B-D087A4F9E762	Rimbaud A.	Maiz bestetan esana aipatzea zilegi bazait, hemen ere esango dut Saussure dela linguistikak izan duen Rimbaud bakarra, Rimbauden pare, hogeiren bat urte dituelarik burutzen du bere Mémoire sur le système primitif des voyelles dans les langues indo-européennes.
Q47446-028B082F-FC1F-4826-9C57-DA99564CA207	Rodríguez Adrados F.	No obstante, no faltan voces discordantes y últimamente F. Rodríguez Adrados, en una de las obras más importantes que en esta disciplina se han producido en España,11 basa su construcción en una crítica detenida del concepto neogramático de ley fonética y de su aplicación a la reconstrucción comparativa.
Q47463-EFF8FC70-690C-486D-BA4D-BF930DE44B7F	Rotaetxe K.	El doble tratamiento vizcaíno u occidental de -a final de tema más -a o -a- difícilmente entra en la regla que K. Rotaetxe y J. L. Doneux,  «Sur un point de morphologie nominal du basque» , FLV 3 (1971),  269-290 , p. 277, enuncian así para Ondarroa: «Une séquence o-a-a-k est représenté par /-ak/ (Règle du double a non final).
Q47454-390AF6CD-C224-4EA2-8AB5-BB64FC7606C0	Rohlfs G.	Sus nombres, sin embargo, no deben hacernos olvidar el de Gerhard Rohlfs y lo que va, en lo que aquí nos toca, de la 1.
Q47454-D02C14A1-73FE-4B82-B16F-A94F7ED742B6	Rohlfs G.	-otz[e], -oze) y en -ué, uy, debidas sobre todo a G. Rohlfs y J. Séguy, lo esencial del estudio de Menéndez Pidal, sobre todo en lo que se refiere a los límites sucesivos de la romanización lato sensu, conservan todo su valor.
Q47459-428ED2FE-568D-4007-8D8F-8E4B0E4A58B7	Rosenbaum P. S.	Nik ezagutzen dudan osoena, eta errazena, Jacobs eta Rosenbaumen English transformational grammar (1968) da.
Q47460-46386C2E-109E-4AD2-8964-D78C4BAC3EB8	Ross A. S. C.	¿Cómo puede determinar la distribución de un morfema en una protolengua e incluso en muchos estados de lengua? Incidentalmente, la complicada notación aplicada por A. S. C. Ross, Etymology, with especial reference to English, New Jersey 1958, y retocada por su crítico Eric P. Hamp,  reseña de id.
Q47461-A5179915-97C3-4BE1-B089-4E76226F51D8	Rössler O.	27 Así uno se pregunta qué es lo que se supone representa el esquema de la evolución de las lenguas hamito-semíticas trazado por Otto Rössler,  «Verbalbau und Verbalflexion in den Semitohamitischen Sprachen.
Q47479-15D7FBC7-1881-448A-BA0D-186A3088423E	Russell B.	Bertrand Russell, El conocimiento humano.
Q47479-76C45BAA-3ECA-424B-8091-2AE5ED9E6BA4	Russell B.	Zenbaitek uste du, dirudienez, liburuxka hau dela jakite berriaren Biblia hondargabea, beste sail batean Russell-Whiteheaden Principia mathematica izan zenaren parekoa.
Q47482-BAC7ED11-0ACB-478C-A253-4D0D70A975D8	Ruwet N.	Bada Saussureren pasarte bat, Ruwetengan irakur dezakezuena.
Q47483-607039B7-3685-4094-9FD3-C1A0D105CBEA	Sacaze J.	Esto ya aparece con claridad en la colección de J. Sacaze, Inscriptions antiques des Pyrénées, Toulouse 1892.
Q47486-233182DB-4DB6-4663-A191-709593054D1B	Safarewicz J.	Jan Safarewicz, Linguistic studies, La Haya-París 1974, p. 122, expone con particular claridad que la lengua, en la medida en que es común, va, como hecho social, unida a la organización de una sociedad, organización que permite que haya un intercambio eficaz y duradero entre sus grupos más o menos compactos o dispersos.
Q47506-25C6B346-1C7B-4304-983B-B9F4591CCA73	Salustio	Salustiok, esate baterako, honako esaldi hau eskaintzen digu: Nam fere quem quisque in pugnando locum ceperat, eum amissa anima corpore tegebat.
Q47509-5FB49506-A7AF-422D-A8D7-803463E1FC50	Samaniego F. M.ª de	Noski, honek ere Samaniegoren alegiek bezala badu bere irakatsia.
Q47511-5E1C8A67-8176-487C-8210-8639F35B37FB	San Agustín	Urrutikoa da, noski, oihartzun hori, baina ez ote ziren zeharbidez etorri Platonen irakatsiak San Agustin batengana ere? Eginahalean saiatu zaigu hemen Zaitegi euskara garbian Platonen gogoetak ahalik argien azaltzen.
Q47517-4DAD0B9E-1A45-4D40-9F53-BB92C4F240FD	San Francisco de Sales	Predominan los textos de edificación, y entre ellos en muy primer lugar traducciones: hay traducción labortana y suletina del Kempis (Chourio y Maister), de San Francisco de Sales, del padre Scupoli, un Nuevo Testamento que, en su versión original, sigue todavía inédito.
Q47523-3C55B4D3-ECBD-49D8-9DB6-C9E4569BF79D	San Martin J. (‘Otsalar’)	Hiru hitzaurre ditu argitaraldi honek: egilearena berarena aurrenik, Domingo Agirrek bigarrenari ipini ziona ondoren eta orain Juan San Martinek ederki baino ederkiago moldatu duena azkenik.
Q47523-3C55B4D3-ECBD-49D8-9DB6-C9E4569BF79D	San Martin J. (‘Otsalar’)	Badakigu, eta ederki azaltzen du hori San Martinek beste hainbeste gauza bezala, alferrik joko dugula honelako ipuin eta alegietara gai berrien bila.
Q47523-B9F36AAA-D397-4F88-937C-B1C446D40438	San Martin J. (‘Otsalar’)	Juan San Martin izan da, dakidanez, leialkienik erdal deitura horri lotu zaiona bere Escritores euskéricos, Bilbao 1968 (duela hamar urte, beraz), delako liburu ezagunean.
Q47571-641D8B55-E5C8-4B69-8220-C0C445340F6A	Sarría J. de	Revista del País Vasco (1917-1922), dirigida por Jesús de Sarría, en la que el vascuence tuvo por cierto poca entrada.
Q47555-21CCC0EA-4D29-495A-BA4D-D101DD188D1C	Santa Teresa B. de (Fray Bartolomé)	Sólo se puede hacer una breve relación de otros autores que nacieron bien dentro del siglo XVIII. El carmelita fray Bartolomé de Santa Teresa (1768-1835), elocuentemente belicoso, escribió en vizcaíno marquinés como Moguel.
Q47561-8ACD42F5-5007-4595-8BED-F9856F38718C	Sapir E.	Como ha subrayado muchas veces Sapir,1 un idioma es un producto histórico extremadamente complejo que oculta, bajo los elementos activos y productivos de su estructura, estratos varios de fecha muy diversa que, aunque pueden ser dados de lado en un análisis sincrónico, no aciertan a escapar del todo a las técnicas que se han desarrollado para reanimar la información muerta, es decir para dar una cierta dimensión de profundidad temporal a la imagen plana de un estado de lengua dado.
Q47561-913A9E13-F7DF-4DB9-903B-8A6E394ED265	Sapir E.	Sapirek ere honela dio: «Ene ustez, hizkuntza lehen kultur agerpenak baino lehenagokoa da, eta, egia esan, agerpen hauek berauek ere ezinkizun ziren harik eta hizkuntza mintzabide eta adierazpide egoki bilakatu zen arte».
Q47574-8BDB8282-94F5-4FE4-A093-D87CD4D8AEFC	Sauguis B. de	Reconoce haber tenido como predecesor al suletino Sauguis, con quien contó también como paremiólogo, a cuya memoria dedicó un buen soneto.
Q47576-00B8F5B9-DDA0-433F-9CF1-F662511A0ED3	Saussure F.	6 These labels (accentuation columnale, accentuation marginale), current in Kurylowicz’s works, go back to Saussure’s famous papers on Lithuanian intonations.
Q47576-062EB778-C4C2-40D4-B188-EA40FEEAE1E8	Saussure F.	Saussure, pp. 45 ss.
Q47576-490FAB25-4DF5-475A-AEDB-9283E207850D	Saussure F.	Dakizuenez estrukturalismoa Ferdinand de Saussure ginebrarraren inguruan sortzen da.
Q47576-490FAB25-4DF5-475A-AEDB-9283E207850D	Saussure F.	Maiz bestetan esana aipatzea zilegi bazait, hemen ere esango dut Saussure dela linguistikak izan duen Rimbaud bakarra, Rimbauden pare, hogeiren bat urte dituelarik burutzen du bere Mémoire sur le système primitif des voyelles dans les langues indo-européennes.
Q47576-CE32BDF6-5DEE-4A07-B969-4120F234157D	Saussure F.	Zenbait idazle elkorrak gertatzen dira sail horretan, horrelaxe «Lizardi» (Sully-Prudhommeren aipamen aitortuaz kanpo)b3eta horrela, beste alor batean, aitzindarien artean Whitney baizik aipatu ez zuen Saussure. Emankorrak beste batzuk, Lauaxeta eta batez ere azken aldiko Lauaxeta bezala, itxurarik zaharrenean orain Oihenartengan ageri den Aita nuen saltzaile herri-poemaz ere baliatu baitzen.
Q47586-306EB8A6-B6AA-47F8-811A-789F3C0ED47E	Schiller F.	Hori da, aspaldidanik zetorrela, Schillerek «Die Kräniche des Ibykus» poeman jaso zuena edo, hurbilago, «Itoxurak ziñaldari» izenarekin Kirikiñoren Abarretan irakur dezakeguna.
Q47586-A63D66B1-3767-4401-B0D3-4A2FF1E2C18C	Schiller F.	Son de mayor empeño las traducciones: el Nuevo Testamento por el padre Olabide, Wilhelm Tell de Schiller por I. Goenaga, Christmass Carol por Arcelus, poetas románticos alemanes por P. Iraizoz, modelo de lenguaje popular en su concordia de los Evangelios.
Q47586-C3E429DA-C7F7-49EF-8328-FD8A4E3576D5	Schiller F.	21 Nahiz, ‘itoizura’, Kirikiñoren ipuinean, edo ‘kurrilloak’ Schilleren Die Kraniche des Ibycus baladan.
Q47587-77F97A07-236C-48F2-A1E2-C1B07200D81E	Schlegel F.	Es cierto que la previsión en lingüística diacrónica tiene fundamentalmente un sentido: es una previsión del pasado (y también del presente, como acabamos de ver),18 pero no del futuro, en el sentido en que Schlegel decía que un historiador es un profeta del pasado, aunque con medios para determinar «lo que podía haber sido» e incluso «lo que debía haber sido», al contrario de lo que ocurre en las ciencias naturales, donde se trata por lo general de previsión en sentido propio, de previsión del futuro.
