Wikidata	labelBerria	testuingurua	agertokia
Q1324818	ABRIKOT KOLORE	Berdeak baino ez du ukitu hori; abrikot kolorekoak ez du halakorik, nahiz eta prezioa bera den bientzat	Etsaiak, lagunak, ezkongaiak, maitaleak, senar-emazteak, Alice Munro (Isabel Etxeberria Ramirez), Erein-Igela, 2018
Q2925617	ADREILU KOLORE	haize errotek edota adreilu koloreko herri txikiek.	Argia, 2008-09-28, 2152. zbk. | «Txikia bezain ezezaguna», Karlos Zurutuza
Q372973 	AKUAMARINA	Kolore urdin edo turkesa fina dauka	https://eu.wikipedia.org/wiki/Aquamarina
Q4727574	ALIZARINA KARMINA	Alizarina karmina	https://eu.wikipedia.org/wiki/Gorri
Q3116788	ALTZAIRU GRIS	 altzairu grisez diseinatutako sukalde integralera	Dioramak, Patxi Iturregi, Elkar, 2006
Q1003676	ALTZAIRU URDIN	Mirotz eta arranoek altzairu urdinezko ortzia zirrimarratzen zutela.	Ezer gabe hobe, Itxaro Borda, Susa, 2009
Q679355	AMBAR	Garagardo honek anbar kolore iluna du.	https://boga.eus/produktua/boga-neguko/
Q2842346	ANBAR KOLORE	-Nik uste lehoiek anbar koloreko begiak izaten dituztela -esan zien Raulek-.	Etxeak eta hilobiak, Bernardo Atxaga, Pamiela, 2019
Q3117006	ANDERE-MAHATS KOLORE	andere-mahats kolore bizia edo more-ardo kolorea hartzen du.	https://eu.wikipedia.org/wiki/Gibelubel_polit
Q2853007	ANTRAZITA KOLORE	Errepide uher meharra, antrazita kolore, pentze eta lur iraulietan barna kurri doana.	Fragmentuak, Aurelia Arkotxa, Utriusque Vasconiae, 2009
Q3108722	ARAN KOLORE	aran koloreko begi distiratsuekin	Kabitu ezina, Aintzane Usandizaga, Elkar, 2019
Q1411452	ARBEL KOLORE	arbel koloreko begi sakonak itxirik	Egurra Pinotxori, Aritz Gorrotxategi, Alberdania, 2002
Q3014419	ARDO KOLORE	ardo koloreko jertse polit bat.	Jainkoen zigorra, Alberto Ladron Arana, Elkar, 2017
Q2591774	ARKAKUSO KOLORE	zeinari “arkakuso kolore” hasi baitzitzaizkion deitzen	https://www.euskalmuseoa.eus/eu/erakusketak/xehetasunak/66/frivolite-indumentaria-del-siglo-xviii-coleccion-del-museo-san-telmo/
Q5347944	ARRAUTZA OSKOL KOLORE	arrautza oskol batzuen kolorea gogorarazten	Suite frantsesa, Irene Nemirovski (Mikel Garmendia /Jose Antonio Sarasola), Alberdania, 2011
Q3843568	ARTO KOLORE	ogi iluna, arto kolorekoa baina arto gusturik ez.	Jakin aldizkaria, 167 zbk., , 2008 - uztaila-abuztua
Q2725283	AZAFRAI-KOLORE	Kolore urdineko eta azafrai-koloreko jantzi batzuk dituzte, ertzean perlak dituztenak.	Arkeologiako eskuliburua, Askoren artean, EHU/UPV, 2019
Q3554596	BAINILLA KOLORE	horietatik kopuru esanguratsuetan erabiltzen direnak 5 baino ez dira: bainila/banilla kolore, egur kolore, harri kolore, musker kolore eta teila kolore.	https://31eskutik.eus/2023/04/17/kolore-kolore-eta-gustu-guziak/
Q4405716	BERDE ARGI	paretako kolorea berde argia da	Ohe bat ozeanoaren erdian, Mikel Hernandez Abaitua, Erein, 2001
Q2553431	BERDE MILITARRA	alkandora berde militarra irekita eta buruan izar gorridun oihalezko bisera, berdea hau ere.	Odolaren deia, Iñaki Irasizabal, Elkar, 2014
Q1406264	BERDE-HORIXKA	Zurtoin berde-horixka zuen, gogorra.	Gu orduko hauek, Garazi Arrula Ruiz, Txalaparta, 2017
Q646964	BERDE-URDIN		https://www.ehu.eus/documents/2660428/9145670/Koloreak_1.pdf
Q1078214	BERDE-URDIN	water is teal: ura berde urdinxka / berde-urdina da	https://hiztegiak.elhuyar.eus/en/teal
Q1403218	BERENJENA KOLORE	Traje beltzak eta soineko luze ilunak saltzen dituzte gehienbat: "berenjena kolorekoak adibidez, moda-modan daude".	Goienkaria, 2008-10-03, 347. zbk., 347. orr.
Q1358981	BOLI KOLORE	Boli koloreko traje bat soinean	https://www.argia.eus/astekaria/docs/2379/pdf/28.pdf
Q3556203	BOTILA-BERDE KOLORE	gelara sartzen zen argia botila-berde kolorekoa zen,  	Ispilu hautsia, Rodoreda, Merce (Antton Olano), Alberdania / Erein / Igela, 2013
Q919991	BRITISH RACING GREEN BERDE	Adibidez, frantziarrek urdina zuten, ingelesek British Racing Green berdea, italiarrek gorria, etab.	https://kanalak.berria.eus/kanalak/1formula/euskal_herrian/
Q2778382	BRONTZE KOLORE	Ezker aldean leihoak, erdi paretik beherantz brontze koloreko barretatik harizko gortinak eskegirik zituztela.	110. Street-eko geltokia, Iñaki Zabaleta, Elkar, 2003
Q492305  	EIGENGRAU	Eigengrau kolorea gure garunak automatikoki baliatzen duena da ez duenean deus behatzeko.	https://www.gaztezulo.eus/albisteak/begiak-istean-ikusten-duzun-koloreak-izen-bat-du-eigengrau
Q3776737	ERRAUTS-KOLORE	Ilea ez du erabat beltza, areago da errauts-kolore, grisa, edo gaztain-grisa.	https://www.ehu.eus/eeh/cgi/bila?z=2650&l=g
Q3446513	ERRUBI KOLORE	Tetra-bricketan ere fruta zaporeak eta errubi kolore biziak goraipatzen diren garaiotan	https://hiztegiak.elhuyar.eus/eu/errubi
Q2465494	ESMERALDA-BERDE		https://hiztegiak.elhuyar.eus/eu/esmeralda-berde
Q1627085	EZTI KOLORE	eta lainoek ezti koloreko aura bat zeukaten	Etxeak eta hilobiak, Bernardo Atxaga, Pamiela, 2019
Q953243	FRANTZIA URDIN	Frantzia urdin koloreko kasaka	https://danborrada.donostiakultura.eus/eu/helduen-danborradak/alde-zaharra/321-aizepe-danborrada-2
Q972729	GAMUZA KOLORE	pagoetan bizi denean baino gamuza kolore zurbilagoa du	https://eu.wikipedia.org/wiki/Tripaki_argi
Q958363	GARI-KOLORE	Sagardoak iru kondizio behar ditu. Lehenengoa garikolorea.	https://www.euskaltzaindia.eus/index.php?option=com_oehberria&task=bilaketa&Itemid=&lang=eu&definizioak=0&query=kolore&sarrera=154885
Q2040833	GAZTAINA-KOLOREKO	nire nebak gaztaina-koloreko ilea du	https://hiztegiak.elhuyar.eus/es/casta%C3%B1o
Q2334511	GEREZI KOLORE	Migelen aurpegiak gerezi kolorea hartu du.	Irlak, Agustin Arrieta Urtizberea, Erein, 2015
Q536284 	GIBEL KOLORE	"Gero, a beste irugarrena rapidua dok eta gibel-koloria emon biajakok ondo iraotzeko" SM EiTec1 (s.v. iraotu).	https://www.euskaltzaindia.eus/index.php?option=com_oehberria&task=sarreraIkusi&Itemid=340&lang=fr&id=156258
Q310115	GLAUKO	izond. BOT. Kolore berde-urdinxka duena.	http://www1.euskadi.net/harluxet/hiztegia1.asp?sarrera=glauko
Q1402829	GORRI BIOLAZEO	Loreek bost petalo gorri biolazeo edo urdin dituzte	https://eu.wikipedia.org/wiki/Txikipedia:Malba_arrunta
Q5223370	GORRI ILUN	Odol asko ari da galtzen handik, aurpegia maskara gorri ilun batez estalia dauka ia erabat.	Txoria nintzela, Xabier Etxeberria, Elkar, 2019
Q4100014	GORRIZTA	lleva un vestido de color bermejo: soineko gorrizta darama	https://hiztegiak.elhuyar.eus/es/bermejo
Q4281308	GRIS ILUN	gris ilun	https://hiztegiak.elhuyar.eus/es/MARENGO
Q4928721	GRIS-URDIN	Herriko plaza oso dotorea da, harria gris-urdin kolorekoa	https://301kilo.com/
Q2296108	HELIOTROPO KOLORE	xingola ttipi heliotropo-koloredun bat	Denbora galduaren bila I. Swann-etik, Marcel Proust (Joxe Austin Arrieta), Alberdania-Elkar, 2010
Q2013559	IDI-ODOL	adjektiboa zigilatu du idi-odol koloreko letra larri gotikoetan.	Isil-mandataria, Jean Echenoz (Gerardo Markuleta), Meettok, 2016
Q5975887	ITSAS URDIN	Azul marino = itsas urdin	https://hiztegiak.elhuyar.eus/es/azul%20marino
Q2468392	IZPILIKU KOLORE	Izpilikuaren koloreko kaxa txiki bat atera du maletatik eta kaxa hartuta ate aldera jo du.	Pello Lizarralde, Erein, 2002
Q3160411	JADE BERDE	Daliren Kristoa ertz batean, eta jade berdezko Buda bestean.	Izen bereziak, Juan Modesto Arrieta, Erein, 2011
Q628657	JADE KOLORE	Zoruan ezko-oihalezko mosaiko bat dago, erronboide jade-kolorez, urdinez eta zinabriokolorez osatua.	Ulises, James Joyce (Xabier Olarra), Igela, 2015
Q3443208	KADMIO GORRI	margolari frantziarra izan zen kadmio gorria erabili zuen lehen margolarietako bat.	https://eu.wikipedia.org/wiki/Gorri
Q3762375	KADMIO HORI	paleta batez aplikatua gehienbat, kadmio horia da	https://www.guggenheim-bilbao-artitz.eus/erakusketak/chagall-urte-erabakigarriak-1911a1919/katalogoa/er-21/do-621/
Q3621275	KADMIO LARANJA	Artelan batzuek beste tonu batzuk dituzte, adibidez, kadmio laranja, formatu handiagoko sorkuntzetan erabilia. 	https://www.guggenheim-bilbao.eus/eu/erakusketa/la-fuerza-de-un-retrato
Q2932937	KAFE KOLORE	kafe koloreko zapatak eta lepo inguruan jertse arrosa.	Jende desegokia, Gaizka Zabarte, Susa, 2015
Q4009899	KAMUFLAJE KOLORE	Kamuflaje koloreak militar aire nabarmena ematen die hiru estalpeei.	Lasto sua, Aingeru Epaltza, Alberdania, 2005
Q2936397	KANELA KOLORE	bestea gaztetxoa, kanela kolore argikoa, bihurria, alaia...	Zu entzuteko gaude, Xabier Mendiguren, Elkar, 2018
Q958012	KAOBA KOLORE	Ardo horren kaoba kolorea, pasifikazioaren ondorioa da.	https://www.berria.eus/paperekoa/4838/045/003/2011-04-02/ximenez-spinola-upategia.htm
Q2937858	KARAMELU KOLORE	ile labur eta latza zuen, karamelu kolorekoa	Paradisua, Arrate Egaña , Elkar, 2012
Q2906500	KE KOLORE	Hodeiak ke kolore, helio ukituekin.	Kuskue tanden, Iñaki Iñurrieta, Alberdania, 2004
Q534583 	KLEIN URDINA		https://www.kimikarte.eus/2016/02/klein-urdina.html
Q425278 	KOBALTO URDIN	Ming dinastiaren garaian portzelana asko egin zen, portzelana zuria marrazki urdinekin (kobalto urdina),	https://eu.wikipedia.org/wiki/Ming_dinastia
Q2722041	KOBRE KOLORE	Kobre koloreko larruazal eta ile zuri-zuriko zaharrak autoa nahiago zuen aukeran.	Golgota, Xabier Montoia, Elkar, 2008
Q1970335	KOLORE GORDIN	kamisetaren koloea: kolore gordina, zimeldutako ostadarrak // kolore gordin eta indartsuaz	https://www.eup.eus/eu/moda-eta-osagarriak/neska/nesken-kamis
Q7377969	KOLORE GORRAIL	Inguratzen zuen gela kolore gorrail batek.	Bihotz ebatsiak, Pierre Mestrot, Maiatz, 2017
Q2002932	KOLORE UHER	uren kolore uherrak begiratzeko	https://dabilena.elhuyar.eus/simple?type=lemma&query=uher
Q3639443	KOLORE ZURI ZAHAR	Eraikinetan denborarekin kolore zuri zahar esleituak irabazten du	https://www.argia.eus/argia-astekaria/1926/habanan-lurperatutako-euskaldunen-memoria
Q5043987	KORNALINA-KOLORE	Goyl-buruzagi baten larrua ez zen inoiz kornalina-kolorekoa izan.	Reckless - Harrizko haragia, Cornelia Funke (Aiora Jaka), Elkar, 2010
Q2905897	KREMA ARGI KOLORE	ebakitzean krema argi kolore batera pasatzen da	https://eu.wikipedia.org/wiki/Leucoagaricus_americanus
Q5122822	KUARTZO KOLORE	Urteko kolorea. Kolore honek misterioa arnasten du. Kuartzo kolore preziatua iradokitzen digu.	https://guaixe.tok-md.com/pdf/634_G_ETXEBEZITZA_ERAIKUNTZA_GEHIGARRI.pdf
Q2564184	KUIA KOLORE	Zeruertzean more eta kuia koloreko zerrenda leun bat hedatzen zen.	Larrua hotz, Albert Sánchez Piñol (Lander Garro / Zigor Garro), Txalaparta, 2009
Q6502169	LABA KOLORE	laba irakinaren kolore-gama infinitua	https://www.naiz.eus/es/hemeroteca/gaur8/editions/gaur8_2021-10-09-07-00/hemeroteca_articles/sumendiak
Q373173 	LAPIS LAZULI	Aminak, lapis lazuli koloreko tunika zeramanak, Laute-hariak deitutako kontakizunari ekin zion:	Kartografien eta mikrobio narratiboen artean, Amaia Iturbide, Maiatz, 2013
Q3358660	LAPIS LAZULI	Aminak, lapis lazuli koloreko tunika zeramanak	Kartografien eta mikrobio narratiboen artean, Amaia Iturbide, Maiatz, 2013
Q3621276	LARANJA ERRE	zeru ildoxkatuaren ikuskizuna, laranja erre, arrosa argi eta odol-gorrimin laba jario luze bat	Nemesis, Phillip Roth (Beñat Sarasola), Meettok, 2011
Q5402922	LARANJA-ARROSA	tonu monokromoak—laranja-arrosa, urdin turkesa eta erabateko beltza—	https://www.berria.eus/kultura/kritikak/ene-maitea-da_1243337_102.html
Q6555379	LEHOI KOLORE	lehoiaren koloreak ez du zerikusirik zauriarekin.	Kubik antzezlan bat baino gehiago, Askoren artean, EHU, 2015
Q2836489	LEHOI-KOLORE	lehoi-koloreko	https://hiztegiak.elhuyar.eus/en/tawny
Q3746538	LIHO-KOLORE	liho-koloreko ile luze ederra.	Ilargi-harria, Wilkie Collins (Antton Olano), Elkar-Alberdania, 2008
Q906936	LIMA-BERDE	Lima-berde koloreko autoa.	https://www.ehu.eus/documents/2660428/11442024/Koloreak_2.pdf/e05a901e-c9cb-8bcc-cf1d-8b6cb517a779
Q2720565	LIMOI KOLORE	Korridorean barrura etorri gara eta butaka bat erakutsi dit, limoi kolorekoa, esertzera gonbidatuz.	Lagun izoztua, Joseba Sarrionandia, Elkar, 2001
Q846504	MANDARINA KOLORE	Mandarina kolorea, 2012an ezinbestekoa 	https://www.eitb.eus/eu/gaztea/osoa/793080/mandarina-kolorea-2012an-ezinbestekoa/
Q3844391	MANDARINA KOLORE	Mandarina kolorea, 2012an ezinbestekoa	https://www.eitb.eus/eu/gaztea/osoa/793080/mandarina-kolorea-2012an-ezinbestekoa/
Q3985184	MARROI ILUN	kolore marroi ilun matea du	https://www.gipuzkoa.eus/eu/web/sagarrondoak/-/eskolitido-edo-pipiak
Q3080396	MARRUBI KOLORE	Salmahaian zeuden marrubi koloreko litxarrerietatik soa aldendu zuen ezinbestez.	Erlojugilea, Asier Serrano, Txalaparta, 2009
Q3080423	MASUSTA KOLORE	ezpainak masusta kolorez margotuak 	Denboraren izerdia, Xabier Montoia, Elkar, 2003
Q5148721	MELOKOTOI KOLORE	Gutxiagotan, beltzak, melokotoi kolorekoak eta zuri-horixkak izan daitezke.	https://eu.wikipedia.org/wiki/Euskal_Herriko_mendiko_zaldi
Q2996915	MITXOLETA KOLORE	ur gainean mitxoleta koloreko lore bat	Kartografien eta mikrobio narratiboen artean, Amaia Iturbide, Maiatz, 2013
Q2021643	NABARRA-URDIN	 ezerk ez zuen lehengo kolorea eta distira, lehengo ertz definitua eta forma ezaguna, nabarra-urdina nagusitzen zen nonahi	Erretzaileen eremua, Jon Alonso, Susa, 2006
Q899295	NAPOLES-HORI	Napoles-horia	https://www.ehu.eus/documents/2660428/11442024/Koloreak_2.pdf/e05a901e-c9cb-8bcc-cf1d-8b6cb517a779
Q3641130	PAUMA-URDIN	Laranjaren ondoren, hondar-irudi pauma-urdin bat.	Telebista produkzioa, Askoren artean, EHU, 2006
Q7158021	PERLA KOLORE	burua perla kolorekoa du	Jururú, JE Urrutia "Capeau", Pamiela, 2015
Q3556225	PINU-BERDE KOLORE	harekin estetikoki ongi doan pinu-berde koloreko elastiko (jertse) fina.	Fragmentuak, Aurelia Arkotxa, Utriusque Vasconiae, 2009
Q3389253	PISTATXO KOLORE	Pistatxo kolore    =   Color pistacho	https://partekatu.com/colores-en-euskera
Q3906414	PLATINO-KOLORE	Ilargi beteak errepidea bustitzen zuen platino-kolore itzali batez,	Plazeraren gau ilunekoak, Francis Scott Fitzgerald (Garazi Arrula / Iñigo Roque), Elkar, 2014
Q3941700	PONPEIAR GORRI	kolorea arkitekturaren zerbitzura jarri da; beheko solairuan beltza, ponpeiar gorria solairua bereizteko eta trenkada goietan almendra-berdea.	https://zientzia.eus/artikuluak/izan-itxurak-egin-ordez/
Q3491936	SAGU KOLORE	Ene leihoaren parean, sabel sagu koloreak, papoen ortzadarren berde-more distirantak.	Septentrio, Aurelia Arkotxa, Alberdania, 2001
Q2307593	SATOR KOLORE	Sator kolorezko hogeita hiru uso xumeek burua papo eta hegalaren beroan gordea dute.	Septentrio, Aurelia Arkotxa, Alberdania, 2001
Q899318	SIENA	Marian Aranbururen hainbat koadro abstraktu, siena eta gris kolorekoak	https://urolakosta.hitza.eus/urola-kosta/1657288589778-bi-pintzelen-ikuspegia-areto-berean
Q3518540	TERRAKOTA KOLORE	 oinarrian terrakota koloreko hautsak	https://erran.tok-md.com/pdf/ttipi-ttapa-419.pdf
Q6592940	TOMATE KOLORE	tomate kolore bat, tomate gustu bat. 	file:///C:/Users/Docencia/Downloads/AE55.PDF
Q987293	TRAFIKO-HORI	Koloreak: Hondo beltz baten gainean, logotipo trafiko-horia	https://www.portugalete.org/es-ES/VivirenPortugalete/UrbanismoyObras/PGOU/3.pdf
Q3631631	TURKESA ARGI	Hemen, atzealde abstraktu turkesa argi batez, 	https://www.guggenheim-bilbao-artitz.eus/files/dokumentuak/expo2017_parismendeamaiera_katalogoa.pdf
Q3309916	TXOKOLATE-KOLORE	Erasotako arbolen sustrai-lepoak txokolate-kolore iluna izaten du	https://www.gipuzkoa.eus/eu/web/sagarrondoak/-/lepo-usteldura
Q253181 	URDIN EGIPTOAR	Aurkitutako kolore aniztasunak, aberastasun polikromoaren ideia bat ematen du: beltza (asfaltoa), gorria (beira gorri opakoa, bermiloia, okre gorrizko hematitea), berdea, urdin egiptoarra, zuria, horia (okrea edo urrea). Landare pigmentuen erabilera, irudikatua da, baina oraindik ez da pigmentu horien erabileraren frogarik aurkitu.	https://eu.wikipedia.org/wiki/Persepolis
Q3641131	URDIN ILUN	Beste sei bat mutilekin batera zegoen, denak berdintsu jantzita, euren blusa urdin ilun harekin.	Txoria nintzela, Xabier Etxeberria, Elkar, 2019
Q901499	URDIN MAIA	Hala, urdin maia eder hura erraz eta merke ekoizten zuten.	https://www.argia.eus/argia-astekaria/2660/maien-urdinak-ez-du-misteriorik/inprimatu
Q5960345	URDIN TURKESA	Ibizako uren urdin turkesa kolorea	https://hiztegiak.elhuyar.eus/es/turquesa
Q3886119	URRE ZAHAR KOLORE	Paretak urre zaharraren kolore.	Berria, 2004-12-17, «Portua», AURELIA ARKOTXA [Gaiak]
Q5069879	XANPAIN KOLORE	Urre koloreko adats luzea zen, gerrirainokoa, xanpain kolorekoa	Greta, Jasone Osoro, Elkar, 2003
Q2294908	ZAFIRO KOLORE	Zafiro koloreko txabusina bat zeraman, itxuraz garestia; aitaren oparia izango zela ziurtzat jo nuen.	Kometaren eraginpean, Jon Bilbao (Jon Alonso), Txalaparta, 2014
Q373058 	ZERU URDIN		https://hiztegiak.elhuyar.eus/es/cer%C3%BAleo
Q947638	ZERU-URDIN	Kotoizko txabusina zeru-urdin bat.	https://www.ehu.eus/documents/2660428/11442024/Koloreak_2.pdf/e05a901e-c9cb-8bcc-cf1d-8b6cb517a779
Q3639461	ZINK ZURIA	Pigmentuen kolorearen eta izaeraren arabera: zink zuria, urdin kobaltoa, etab.	Eraikuntzako materialak, Nuria Monasterio, UEU, 2009
Q7127114	ZURBIL KOLORE	Zurbil kolorekoa da	https://eu.wikipedia.org/wiki/Txokolate
